19:11:34.452579 IP 159.203.57.152.22 > 162.243.190.66.60588: Flags [P.], seq 5290624:5290864, ack 129, win 502, options [nop,nop,TS val 3494272572 ecr 2826201606], length 240
19:11:34.452622 IP 159.203.57.152.22 > 162.243.190.66.60588: Flags [P.], seq 5290864:5291104, ack 129, win 502, options [nop,nop,TS val 3494272572 ecr 2826201606], length 240
19:11:34.452664 IP 159.203.57.152.22 > 162.243.190.66.60588: Flags [P.], seq 5291104:5291344, ack 129, win 502, options [nop,nop,TS val 3494272572 ecr 2826201606], length 240
19:11:34.452703 IP 159.203.57.152.22 > 162.243.190.66.60588: Flags [P.], seq 5291344:5291584, ack 129, win 502, options [nop,nop,TS val 3494272572 ecr 2826201606], length 240
19:11:34.452745 IP 159.203.57.152.22 > 162.243.190.66.60588: Flags [P.], seq 5291584:5291824, ack 129, win 502, options [nop,nop,TS val 3494272572 ecr 2826201606], length 240
19:11:34.452785 IP 159.203.57.152.22 > 162.243.190.66.60588: Flags [P.], seq 5291824:5292064, ack 129, win 502, options [nop,nop,TS val 3494272572 ecr 2826201606], length 240
19:11:34.452823 IP 159.203.57.152.22 > 162.243.190.66.60588: Flags [P.], seq 5292064:5292304, ack 129, win 502, options [nop,nop,TS val 3494272572 ecr 2826201606], length 240
19:11:34.452864 IP 159.203.57.152.22 > 162.243.190.66.60588: Flags [P.], seq 5292304:5292544, ack 129, win 502, options [nop,nop,TS val 3494272572 ecr 2826201606], length 240
19:11:34.452903 IP 159.203.57.152.22 > 162.243.190.66.60588: Flags [P.], seq 5292544:5292784, ack 129, win 502, options [nop,nop,TS val 3494272572 ecr 2826201606], length 240
19:11:34.452945 IP 159.203.57.152.22 > 162.243.190.66.60588: Flags [P.], seq 5292784:5293024, ack 129, win 502, options [nop,nop,TS val 3494272572 ecr 2826201606], length 240
19:11:34.453004 IP 159.203.57.152.22 > 162.243.190.66.60588: Flags [P.], seq 5293024:5293264, ack 129, win 502, options [nop,nop,TS val 3494272572 ecr 2826201606], length 240
19:11:34.453042 IP 162.243.190.66.60588 > 159.203.57.152.22: Flags [.], ack 5289424, win 501, options [nop,nop,TS val 2826201607 ecr 3494272571], length 0
19:11:34.453042 IP 162.243.190.66.60588 > 159.203.57.152.22: Flags [.], ack 5291584, win 501, options [nop,nop,TS val 2826201607 ecr 3494272571], length 0
19:11:34.453104 IP 159.203.57.152.22 > 162.243.190.66.60588: Flags [P.], seq 5293264:5293808, ack 129, win 502, options [nop,nop,TS val 3494272572 ecr 2826201607], length 544
19:11:34.453149 IP 159.203.57.152.22 > 162.243.190.66.60588: Flags [P.], seq 5293808:5294048, ack 129, win 502, options [nop,nop,TS val 3494272572 ecr 2826201607], length 240
19:11:34.453190 IP 159.203.57.152.22 > 162.243.190.66.60588: Flags [P.], seq 5294048:5294288, ack 129, win 502, options [nop,nop,TS val 3494272572 ecr 2826201607], length 240
19:11:34.453231 IP 159.203.57.152.22 > 162.243.190.66.60588: Flags [P.], seq 5294288:5294528, ack 129, win 502, options [nop,nop,TS val 3494272572 ecr 2826201607], length 240
19:11:34.453273 IP 159.203.57.152.22 > 162.243.190.66.60588: Flags [P.], seq 5294528:5294768, ack 129, win 502, options [nop,nop,TS val 3494272572 ecr 2826201607], length 240
19:11:34.453298 IP 162.243.190.66.60588 > 159.203.57.152.22: Flags [.], ack 5293264, win 501, options [nop,nop,TS val 2826201607 ecr 3494272572], length 0
19:11:34.453339 IP 159.203.57.152.22 > 162.243.190.66.60588: Flags [P.], seq 5294768:5295152, ack 129, win 502, options [nop,nop,TS val 3494272572 ecr 2826201607], length 384
19:11:34.453381 IP 159.203.57.152.22 > 162.243.190.66.60588: Flags [P.], seq 5295152:5295392, ack 129, win 502, options [nop,nop,TS val 3494272572 ecr 2826201607], length 240
19:11:34.453442 IP 159.203.57.152.22 > 162.243.190.66.60588: Flags [P.], seq 5295392:5295632, ack 129, win 502, options [nop,nop,TS val 3494272572 ecr 2826201607], length 240
19:11:34.453496 IP 159.203.57.152.22 > 162.243.190.66.60588: Flags [P.], seq 5295632:5295872, ack 129, win 502, options [nop,nop,TS val 3494272572 ecr 2826201607], length 240
19:11:34.453536 IP 159.203.57.152.22 > 162.243.190.66.60588: Flags [P.], seq 5295872:5296112, ack 129, win 502, options [nop,nop,TS val 3494272572 ecr 2826201607], length 240
19:11:34.453574 IP 159.203.57.152.22 > 162.243.190.66.60588: Flags [P.], seq 5296112:5296352, ack 129, win 502, options [nop,nop,TS val 3494272573 ecr 2826201607], length 240
19:11:34.453614 IP 159.203.57.152.22 > 162.243.190.66.60588: Flags [P.], seq 5296352:5296592, ack 129, win 502, options [nop,nop,TS val 3494272573 ecr 2826201607], length 240
19:11:34.453653 IP 159.203.57.152.22 > 162.243.190.66.60588: Flags [P.], seq 5296592:5296832, ack 129, win 502, options [nop,nop,TS val 3494272573 ecr 2826201607], length 240
19:11:34.453704 IP 159.203.57.152.22 > 162.243.190.66.60588: Flags [P.], seq 5296832:5297072, ack 129, win 502, options [nop,nop,TS val 3494272573 ecr 2826201607], length 240
19:11:34.453726 IP 162.243.190.66.60588 > 159.203.57.152.22: Flags [.], ack 5294768, win 501, options [nop,nop,TS val 2826201608 ecr 3494272572], length 0
19:11:34.453769 IP 159.203.57.152.22 > 162.243.190.66.60588: Flags [P.], seq 5297072:5297456, ack 129, win 502, options [nop,nop,TS val 3494272573 ecr 2826201608], length 384
19:11:34.453811 IP 159.203.57.152.22 > 162.243.190.66.60588: Flags [P.], seq 5297456:5297696, ack 129, win 502, options [nop,nop,TS val 3494272573 ecr 2826201608], length 240
19:11:34.453850 IP 159.203.57.152.22 > 162.243.190.66.60588: Flags [P.], seq 5297696:5297936, ack 129, win 502, options [nop,nop,TS val 3494272573 ecr 2826201608], length 240
19:11:34.453874 IP 162.243.190.66.60588 > 159.203.57.152.22: Flags [.], ack 5296352, win 501, options [nop,nop,TS val 2826201608 ecr 3494272572], length 0
19:11:34.453912 IP 159.203.57.152.22 > 162.243.190.66.60588: Flags [P.], seq 5297936:5298320, ack 129, win 502, options [nop,nop,TS val 3494272573 ecr 2826201608], length 384
19:11:34.453954 IP 159.203.57.152.22 > 162.243.190.66.60588: Flags [P.], seq 5298320:5298560, ack 129, win 502, options [nop,nop,TS val 3494272573 ecr 2826201608], length 240
19:11:34.453995 IP 159.203.57.152.22 > 162.243.190.66.60588: Flags [P.], seq 5298560:5298800, ack 129, win 502, options [nop,nop,TS val 3494272573 ecr 2826201608], length 240
19:11:34.454033 IP 159.203.57.152.22 > 162.243.190.66.60588: Flags [P.], seq 5298800:5299040, ack 129, win 502, options [nop,nop,TS val 3494272573 ecr 2826201608], length 240
19:11:34.454097 IP 159.203.57.152.22 > 162.243.190.66.60588: Flags [P.], seq 5299040:5299280, ack 129, win 502, options [nop,nop,TS val 3494272573 ecr 2826201608], length 240
19:11:34.454160 IP 159.203.57.152.22 > 162.243.190.66.60588: Flags [P.], seq 5299280:5299520, ack 129, win 502, options [nop,nop,TS val 3494272573 ecr 2826201608], length 240
19:11:34.454214 IP 159.203.57.152.22 > 162.243.190.66.60588: Flags [P.], seq 5299520:5299760, ack 129, win 502, options [nop,nop,TS val 3494272573 ecr 2826201608], length 240
19:11:34.454267 IP 159.203.57.152.22 > 162.243.190.66.60588: Flags [P.], seq 5299760:5300000, ack 129, win 502, options [nop,nop,TS val 3494272573 ecr 2826201608], length 240
19:11:34.454302 IP 162.243.190.66.60588 > 159.203.57.152.22: Flags [.], ack 5298320, win 501, options [nop,nop,TS val 2826201608 ecr 3494272573], length 0
19:11:34.454340 IP 159.203.57.152.22 > 162.243.190.66.60588: Flags [P.], seq 5300000:5300384, ack 129, win 502, options [nop,nop,TS val 3494272573 ecr 2826201608], length 384
19:11:34.454379 IP 159.203.57.152.22 > 162.243.190.66.60588: Flags [P.], seq 5300384:5300624, ack 129, win 502, options [nop,nop,TS val 3494272573 ecr 2826201608], length 240
19:11:34.454434 IP 159.203.57.152.22 > 162.243.190.66.60588: Flags [P.], seq 5300624:5300864, ack 129, win 502, options [nop,nop,TS val 3494272573 ecr 2826201608], length 240
19:11:34.454480 IP 159.203.57.152.22 > 162.243.190.66.60588: Flags [P.], seq 5300864:5301104, ack 129, win 502, options [nop,nop,TS val 3494272573 ecr 2826201608], length 240
19:11:34.454524 IP 162.243.190.66.60588 > 159.203.57.152.22: Flags [.], ack 5300000, win 501, options [nop,nop,TS val 2826201609 ecr 3494272573], length 0
19:11:34.454548 IP 159.203.57.152.22 > 162.243.190.66.60588: Flags [P.], seq 5301104:5301344, ack 129, win 502, options [nop,nop,TS val 3494272573 ecr 2826201609], length 240
19:11:34.454574 IP 159.203.57.152.22 > 162.243.190.66.60588: Flags [P.], seq 5301344:5301552, ack 129, win 502, options [nop,nop,TS val 3494272574 ecr 2826201609], length 208
19:11:34.454621 IP 159.203.57.152.22 > 162.243.190.66.60588: Flags [P.], seq 5301552:5301968, ack 129, win 502, options [nop,nop,TS val 3494272574 ecr 2826201609], length 416
19:11:34.454659 IP 159.203.57.152.22 > 162.243.190.66.60588: Flags [P.], seq 5301968:5302208, ack 129, win 502, options [nop,nop,TS val 3494272574 ecr 2826201609], length 240
19:11:34.454697 IP 159.203.57.152.22 > 162.243.190.66.60588: Flags [P.], seq 5302208:5302448, ack 129, win 502, options [nop,nop,TS val 3494272574 ecr 2826201609], length 240
19:11:34.454736 IP 159.203.57.152.22 > 162.243.190.66.60588: Flags [P.], seq 5302448:5302688, ack 129, win 502, options [nop,nop,TS val 3494272574 ecr 2826201609], length 240
19:11:34.454774 IP 159.203.57.152.22 > 162.243.190.66.60588: Flags [P.], seq 5302688:5302928, ack 129, win 502, options [nop,nop,TS val 3494272574 ecr 2826201609], length 240
19:11:34.454815 IP 159.203.57.152.22 > 162.243.190.66.60588: Flags [P.], seq 5302928:5303168, ack 129, win 502, options [nop,nop,TS val 3494272574 ecr 2826201609], length 240
19:11:34.454865 IP 159.203.57.152.22 > 162.243.190.66.60588: Flags [P.], seq 5303168:5303408, ack 129, win 502, options [nop,nop,TS val 3494272574 ecr 2826201609], length 240
19:11:34.454926 IP 159.203.57.152.22 > 162.243.190.66.60588: Flags [P.], seq 5303408:5303648, ack 129, win 502, options [nop,nop,TS val 3494272574 ecr 2826201609], length 240
19:11:34.454982 IP 159.203.57.152.22 > 162.243.190.66.60588: Flags [P.], seq 5303648:5303888, ack 129, win 502, options [nop,nop,TS val 3494272574 ecr 2826201609], length 240
19:11:34.455039 IP 159.203.57.152.22 > 162.243.190.66.60588: Flags [P.], seq 5303888:5304128, ack 129, win 502, options [nop,nop,TS val 3494272574 ecr 2826201609], length 240
19:11:34.455112 IP 159.203.57.152.22 > 162.243.190.66.60588: Flags [P.], seq 5304128:5304368, ack 129, win 502, options [nop,nop,TS val 3494272574 ecr 2826201609], length 240
19:11:34.455170 IP 159.203.57.152.22 > 162.243.190.66.60588: Flags [P.], seq 5304368:5304608, ack 129, win 502, options [nop,nop,TS val 3494272574 ecr 2826201609], length 240
19:11:34.455230 IP 159.203.57.152.22 > 162.243.190.66.60588: Flags [P.], seq 5304608:5304848, ack 129, win 502, options [nop,nop,TS val 3494272574 ecr 2826201609], length 240
19:11:34.455290 IP 159.203.57.152.22 > 162.243.190.66.60588: Flags [P.], seq 5304848:5305088, ack 129, win 502, options [nop,nop,TS val 3494272574 ecr 2826201609], length 240
19:11:34.455332 IP 159.203.57.152.22 > 162.243.190.66.60588: Flags [P.], seq 5305088:5305328, ack 129, win 502, options [nop,nop,TS val 3494272574 ecr 2826201609], length 240
19:11:34.455375 IP 159.203.57.152.22 > 162.243.190.66.60588: Flags [P.], seq 5305328:5305568, ack 129, win 502, options [nop,nop,TS val 3494272574 ecr 2826201609], length 240
19:11:34.455400 IP 162.243.190.66.60588 > 159.203.57.152.22: Flags [.], ack 5302928, win 501, options [nop,nop,TS val 2826201610 ecr 3494272573], length 0
19:11:34.455400 IP 162.243.190.66.60588 > 159.203.57.152.22: Flags [.], ack 5304608, win 501, options [nop,nop,TS val 2826201610 ecr 3494272574], length 0
19:11:34.455454 IP 159.203.57.152.22 > 162.243.190.66.60588: Flags [P.], seq 5305568:5306112, ack 129, win 502, options [nop,nop,TS val 3494272574 ecr 2826201610], length 544
19:11:34.455497 IP 159.203.57.152.22 > 162.243.190.66.60588: Flags [P.], seq 5306112:5306352, ack 129, win 502, options [nop,nop,TS val 3494272574 ecr 2826201610], length 240
19:11:34.455538 IP 159.203.57.152.22 > 162.243.190.66.60588: Flags [P.], seq 5306352:5306592, ack 129, win 502, options [nop,nop,TS val 3494272574 ecr 2826201610], length 240
19:11:34.455580 IP 159.203.57.152.22 > 162.243.190.66.60588: Flags [P.], seq 5306592:5306832, ack 129, win 502, options [nop,nop,TS val 3494272575 ecr 2826201610], length 240
19:11:34.455621 IP 159.203.57.152.22 > 162.243.190.66.60588: Flags [P.], seq 5306832:5307072, ack 129, win 502, options [nop,nop,TS val 3494272575 ecr 2826201610], length 240
19:11:34.455660 IP 159.203.57.152.22 > 162.243.190.66.60588: Flags [P.], seq 5307072:5307312, ack 129, win 502, options [nop,nop,TS val 3494272575 ecr 2826201610], length 240
19:11:34.455690 IP 162.243.190.66.60588 > 159.203.57.152.22: Flags [.], ack 5306112, win 501, options [nop,nop,TS val 2826201610 ecr 3494272574], length 0
19:11:34.455730 IP 159.203.57.152.22 > 162.243.190.66.60588: Flags [P.], seq 5307312:5307696, ack 129, win 502, options [nop,nop,TS val 3494272575 ecr 2826201610], length 384
19:11:34.455773 IP 159.203.57.152.22 > 162.243.190.66.60588: Flags [P.], seq 5307696:5307936, ack 129, win 502, options [nop,nop,TS val 3494272575 ecr 2826201610], length 240
19:11:34.455814 IP 159.203.57.152.22 > 162.243.190.66.60588: Flags [P.], seq 5307936:5308176, ack 129, win 502, options [nop,nop,TS val 3494272575 ecr 2826201610], length 240
19:11:34.455856 IP 159.203.57.152.22 > 162.243.190.66.60588: Flags [P.], seq 5308176:5308416, ack 129, win 502, options [nop,nop,TS val 3494272575 ecr 2826201610], length 240
19:11:34.455897 IP 159.203.57.152.22 > 162.243.190.66.60588: Flags [P.], seq 5308416:5308656, ack 129, win 502, options [nop,nop,TS val 3494272575 ecr 2826201610], length 240
19:11:34.455909 IP 162.243.190.66.60588 > 159.203.57.152.22: Flags [.], ack 5307696, win 501, options [nop,nop,TS val 2826201610 ecr 3494272574], length 0
19:11:34.455952 IP 159.203.57.152.22 > 162.243.190.66.60588: Flags [P.], seq 5308656:5309040, ack 129, win 502, options [nop,nop,TS val 3494272575 ecr 2826201610], length 384
19:11:34.456011 IP 159.203.57.152.22 > 162.243.190.66.60588: Flags [P.], seq 5309040:5309280, ack 129, win 502, options [nop,nop,TS val 3494272575 ecr 2826201610], length 240
19:11:34.456071 IP 159.203.57.152.22 > 162.243.190.66.60588: Flags [P.], seq 5309280:5309520, ack 129, win 502, options [nop,nop,TS val 3494272575 ecr 2826201610], length 240
19:11:34.456119 IP 159.203.57.152.22 > 162.243.190.66.60588: Flags [P.], seq 5309520:5309760, ack 129, win 502, options [nop,nop,TS val 3494272575 ecr 2826201610], length 240
19:11:34.456159 IP 159.203.57.152.22 > 162.243.190.66.60588: Flags [P.], seq 5309760:5310000, ack 129, win 502, options [nop,nop,TS val 3494272575 ecr 2826201610], length 240
19:11:34.456200 IP 159.203.57.152.22 > 162.243.190.66.60588: Flags [P.], seq 5310000:5310240, ack 129, win 502, options [nop,nop,TS val 3494272575 ecr 2826201610], length 240
19:11:34.456239 IP 159.203.57.152.22 > 162.243.190.66.60588: Flags [P.], seq 5310240:5310480, ack 129, win 502, options [nop,nop,TS val 3494272575 ecr 2826201610], length 240
19:11:34.456277 IP 159.203.57.152.22 > 162.243.190.66.60588: Flags [P.], seq 5310480:5310720, ack 129, win 502, options [nop,nop,TS val 3494272575 ecr 2826201610], length 240
19:11:34.456348 IP 159.203.57.152.22 > 162.243.190.66.60588: Flags [P.], seq 5310720:5310960, ack 129, win 502, options [nop,nop,TS val 3494272575 ecr 2826201610], length 240
19:11:34.456417 IP 159.203.57.152.22 > 162.243.190.66.60588: Flags [P.], seq 5310960:5311200, ack 129, win 502, options [nop,nop,TS val 3494272575 ecr 2826201610], length 240
19:11:34.456460 IP 159.203.57.152.22 > 162.243.190.66.60588: Flags [P.], seq 5311200:5311440, ack 129, win 502, options [nop,nop,TS val 3494272575 ecr 2826201610], length 240
19:11:34.456501 IP 159.203.57.152.22 > 162.243.190.66.60588: Flags [P.], seq 5311440:5311680, ack 129, win 502, options [nop,nop,TS val 3494272575 ecr 2826201610], length 240
19:11:34.456540 IP 159.203.57.152.22 > 162.243.190.66.60588: Flags [P.], seq 5311680:5311920, ack 129, win 502, options [nop,nop,TS val 3494272575 ecr 2826201610], length 240
19:11:34.456581 IP 159.203.57.152.22 > 162.243.190.66.60588: Flags [P.], seq 5311920:5312160, ack 129, win 502, options [nop,nop,TS val 3494272576 ecr 2826201610], length 240
19:11:34.456623 IP 159.203.57.152.22 > 162.243.190.66.60588: Flags [P.], seq 5312160:5312400, ack 129, win 502, options [nop,nop,TS val 3494272576 ecr 2826201610], length 240
19:11:34.456662 IP 159.203.57.152.22 > 162.243.190.66.60588: Flags [P.], seq 5312400:5312640, ack 129, win 502, options [nop,nop,TS val 3494272576 ecr 2826201610], length 240
19:11:34.456705 IP 159.203.57.152.22 > 162.243.190.66.60588: Flags [P.], seq 5312640:5312880, ack 129, win 502, options [nop,nop,TS val 3494272576 ecr 2826201610], length 240
19:11:34.456748 IP 162.243.190.66.60588 > 159.203.57.152.22: Flags [.], ack 5311200, win 501, options [nop,nop,TS val 2826201611 ecr 3494272575], length 0
19:11:34.456748 IP 162.243.190.66.60588 > 159.203.57.152.22: Flags [.], ack 5309280, win 501, options [nop,nop,TS val 2826201611 ecr 3494272575], length 0
19:11:34.456786 IP 159.203.57.152.22 > 162.243.190.66.60588: Flags [P.], seq 5312880:5313120, ack 129, win 502, options [nop,nop,TS val 3494272576 ecr 2826201611], length 240
19:11:34.456814 IP 159.203.57.152.22 > 162.243.190.66.60588: Flags [P.], seq 5313120:5313488, ack 129, win 502, options [nop,nop,TS val 3494272576 ecr 2826201611], length 368
19:11:34.456862 IP 159.203.57.152.22 > 162.243.190.66.60588: Flags [P.], seq 5313488:5313904, ack 129, win 502, options [nop,nop,TS val 3494272576 ecr 2826201611], length 416
19:11:34.456902 IP 159.203.57.152.22 > 162.243.190.66.60588: Flags [P.], seq 5313904:5314144, ack 129, win 502, options [nop,nop,TS val 3494272576 ecr 2826201611], length 240
19:11:34.456941 IP 162.243.190.66.60588 > 159.203.57.152.22: Flags [.], ack 5312880, win 501, options [nop,nop,TS val 2826201611 ecr 3494272575], length 0
19:11:34.456968 IP 159.203.57.152.22 > 162.243.190.66.60588: Flags [P.], seq 5314144:5314384, ack 129, win 502, options [nop,nop,TS val 3494272576 ecr 2826201611], length 240
19:11:34.457006 IP 159.203.57.152.22 > 162.243.190.66.60588: Flags [P.], seq 5314384:5314592, ack 129, win 502, options [nop,nop,TS val 3494272576 ecr 2826201611], length 208
19:11:34.457044 IP 159.203.57.152.22 > 162.243.190.66.60588: Flags [P.], seq 5314592:5314832, ack 129, win 502, options [nop,nop,TS val 3494272576 ecr 2826201611], length 240
19:11:34.457081 IP 159.203.57.152.22 > 162.243.190.66.60588: Flags [P.], seq 5314832:5315072, ack 129, win 502, options [nop,nop,TS val 3494272576 ecr 2826201611], length 240
19:11:34.457107 IP 159.203.57.152.22 > 162.243.190.66.60588: Flags [P.], seq 5315072:5315312, ack 129, win 502, options [nop,nop,TS val 3494272576 ecr 2826201611], length 240
19:11:34.457144 IP 162.243.190.66.60588 > 159.203.57.152.22: Flags [.], ack 5314384, win 501, options [nop,nop,TS val 2826201611 ecr 3494272576], length 0
19:11:34.457164 IP 159.203.57.152.22 > 162.243.190.66.60588: Flags [P.], seq 5315312:5315728, ack 129, win 502, options [nop,nop,TS val 3494272576 ecr 2826201611], length 416
19:11:34.457215 IP 159.203.57.152.22 > 162.243.190.66.60588: Flags [P.], seq 5315728:5316112, ack 129, win 502, options [nop,nop,TS val 3494272576 ecr 2826201611], length 384
19:11:34.457253 IP 159.203.57.152.22 > 162.243.190.66.60588: Flags [P.], seq 5316112:5316352, ack 129, win 502, options [nop,nop,TS val 3494272576 ecr 2826201611], length 240
19:11:34.457292 IP 159.203.57.152.22 > 162.243.190.66.60588: Flags [P.], seq 5316352:5316592, ack 129, win 502, options [nop,nop,TS val 3494272576 ecr 2826201611], length 240
19:11:34.457330 IP 159.203.57.152.22 > 162.243.190.66.60588: Flags [P.], seq 5316592:5316832, ack 129, win 502, options [nop,nop,TS val 3494272576 ecr 2826201611], length 240
19:11:34.457371 IP 159.203.57.152.22 > 162.243.190.66.60588: Flags [P.], seq 5316832:5317072, ack 129, win 502, options [nop,nop,TS val 3494272576 ecr 2826201611], length 240
19:11:34.457411 IP 159.203.57.152.22 > 162.243.190.66.60588: Flags [P.], seq 5317072:5317312, ack 129, win 502, options [nop,nop,TS val 3494272576 ecr 2826201611], length 240
19:11:34.457451 IP 159.203.57.152.22 > 162.243.190.66.60588: Flags [P.], seq 5317312:5317552, ack 129, win 502, options [nop,nop,TS val 3494272576 ecr 2826201611], length 240
19:11:34.457491 IP 159.203.57.152.22 > 162.243.190.66.60588: Flags [P.], seq 5317552:5317792, ack 129, win 502, options [nop,nop,TS val 3494272576 ecr 2826201611], length 240
19:11:34.457530 IP 159.203.57.152.22 > 162.243.190.66.60588: Flags [P.], seq 5317792:5318032, ack 129, win 502, options [nop,nop,TS val 3494272576 ecr 2826201611], length 240
19:11:34.457571 IP 159.203.57.152.22 > 162.243.190.66.60588: Flags [P.], seq 5318032:5318272, ack 129, win 502, options [nop,nop,TS val 3494272576 ecr 2826201611], length 240
19:11:34.457610 IP 159.203.57.152.22 > 162.243.190.66.60588: Flags [P.], seq 5318272:5318512, ack 129, win 502, options [nop,nop,TS val 3494272577 ecr 2826201611], length 240
19:11:34.457649 IP 159.203.57.152.22 > 162.243.190.66.60588: Flags [P.], seq 5318512:5318752, ack 129, win 502, options [nop,nop,TS val 3494272577 ecr 2826201611], length 240
19:11:34.457704 IP 159.203.57.152.22 > 162.243.190.66.60588: Flags [P.], seq 5318752:5318992, ack 129, win 502, options [nop,nop,TS val 3494272577 ecr 2826201611], length 240
19:11:34.457745 IP 159.203.57.152.22 > 162.243.190.66.60588: Flags [P.], seq 5318992:5319232, ack 129, win 502, options [nop,nop,TS val 3494272577 ecr 2826201611], length 240
19:11:34.457783 IP 159.203.57.152.22 > 162.243.190.66.60588: Flags [P.], seq 5319232:5319472, ack 129, win 502, options [nop,nop,TS val 3494272577 ecr 2826201611], length 240
19:11:34.457822 IP 159.203.57.152.22 > 162.243.190.66.60588: Flags [P.], seq 5319472:5319712, ack 129, win 502, options [nop,nop,TS val 3494272577 ecr 2826201611], length 240
19:11:34.457862 IP 159.203.57.152.22 > 162.243.190.66.60588: Flags [P.], seq 5319712:5319952, ack 129, win 502, options [nop,nop,TS val 3494272577 ecr 2826201611], length 240
19:11:34.457908 IP 159.203.57.152.22 > 162.243.190.66.60588: Flags [P.], seq 5319952:5320192, ack 129, win 502, options [nop,nop,TS val 3494272577 ecr 2826201611], length 240
19:11:34.457946 IP 159.203.57.152.22 > 162.243.190.66.60588: Flags [P.], seq 5320192:5320432, ack 129, win 502, options [nop,nop,TS val 3494272577 ecr 2826201611], length 240
19:11:34.458001 IP 159.203.57.152.22 > 162.243.190.66.60588: Flags [P.], seq 5320432:5320672, ack 129, win 502, options [nop,nop,TS val 3494272577 ecr 2826201611], length 240
19:11:34.458055 IP 159.203.57.152.22 > 162.243.190.66.60588: Flags [P.], seq 5320672:5320912, ack 129, win 502, options [nop,nop,TS val 3494272577 ecr 2826201611], length 240
19:11:34.458111 IP 159.203.57.152.22 > 162.243.190.66.60588: Flags [P.], seq 5320912:5321152, ack 129, win 502, options [nop,nop,TS val 3494272577 ecr 2826201611], length 240
19:11:34.458162 IP 159.203.57.152.22 > 162.243.190.66.60588: Flags [P.], seq 5321152:5321392, ack 129, win 502, options [nop,nop,TS val 3494272577 ecr 2826201611], length 240
19:11:34.458216 IP 159.203.57.152.22 > 162.243.190.66.60588: Flags [P.], seq 5321392:5321632, ack 129, win 502, options [nop,nop,TS val 3494272577 ecr 2826201611], length 240
19:11:34.458269 IP 159.203.57.152.22 > 162.243.190.66.60588: Flags [P.], seq 5321632:5321872, ack 129, win 502, options [nop,nop,TS val 3494272577 ecr 2826201611], length 240
19:11:34.458322 IP 159.203.57.152.22 > 162.243.190.66.60588: Flags [P.], seq 5321872:5322112, ack 129, win 502, options [nop,nop,TS val 3494272577 ecr 2826201611], length 240
19:11:34.458381 IP 159.203.57.152.22 > 162.243.190.66.60588: Flags [P.], seq 5322112:5322352, ack 129, win 502, options [nop,nop,TS val 3494272577 ecr 2826201611], length 240
19:11:34.458440 IP 159.203.57.152.22 > 162.243.190.66.60588: Flags [P.], seq 5322352:5322592, ack 129, win 502, options [nop,nop,TS val 3494272577 ecr 2826201611], length 240
19:11:34.458485 IP 159.203.57.152.22 > 162.243.190.66.60588: Flags [P.], seq 5322592:5322832, ack 129, win 502, options [nop,nop,TS val 3494272577 ecr 2826201611], length 240
19:11:34.458527 IP 159.203.57.152.22 > 162.243.190.66.60588: Flags [P.], seq 5322832:5323072, ack 129, win 502, options [nop,nop,TS val 3494272577 ecr 2826201611], length 240
19:11:34.458566 IP 159.203.57.152.22 > 162.243.190.66.60588: Flags [P.], seq 5323072:5323312, ack 129, win 502, options [nop,nop,TS val 3494272577 ecr 2826201611], length 240
19:11:34.458609 IP 159.203.57.152.22 > 162.243.190.66.60588: Flags [P.], seq 5323312:5323552, ack 129, win 502, options [nop,nop,TS val 3494272578 ecr 2826201611], length 240
19:11:34.458648 IP 159.203.57.152.22 > 162.243.190.66.60588: Flags [P.], seq 5323552:5323792, ack 129, win 502, options [nop,nop,TS val 3494272578 ecr 2826201611], length 240
19:11:34.458688 IP 159.203.57.152.22 > 162.243.190.66.60588: Flags [P.], seq 5323792:5324032, ack 129, win 502, options [nop,nop,TS val 3494272578 ecr 2826201611], length 240
19:11:34.458730 IP 159.203.57.152.22 > 162.243.190.66.60588: Flags [P.], seq 5324032:5324272, ack 129, win 502, options [nop,nop,TS val 3494272578 ecr 2826201611], length 240
19:11:34.458770 IP 159.203.57.152.22 > 162.243.190.66.60588: Flags [P.], seq 5324272:5324512, ack 129, win 502, options [nop,nop,TS val 3494272578 ecr 2826201611], length 240
19:11:34.458811 IP 159.203.57.152.22 > 162.243.190.66.60588: Flags [P.], seq 5324512:5324752, ack 129, win 502, options [nop,nop,TS val 3494272578 ecr 2826201611], length 240
19:11:34.458835 IP 162.243.190.66.60588 > 159.203.57.152.22: Flags [.], ack 5316832, win 501, options [nop,nop,TS val 2826201613 ecr 3494272576], length 0
19:11:34.458850 IP 162.243.190.66.60588 > 159.203.57.152.22: Flags [.], ack 5322592, win 501, options [nop,nop,TS val 2826201613 ecr 3494272576], length 0
19:11:34.458901 IP 159.203.57.152.22 > 162.243.190.66.60588: Flags [P.], seq 5324752:5325296, ack 129, win 502, options [nop,nop,TS val 3494272578 ecr 2826201613], length 544
19:11:34.458943 IP 159.203.57.152.22 > 162.243.190.66.60588: Flags [P.], seq 5325296:5325536, ack 129, win 502, options [nop,nop,TS val 3494272578 ecr 2826201613], length 240
19:11:34.458984 IP 159.203.57.152.22 > 162.243.190.66.60588: Flags [P.], seq 5325536:5325776, ack 129, win 502, options [nop,nop,TS val 3494272578 ecr 2826201613], length 240
19:11:34.459025 IP 159.203.57.152.22 > 162.243.190.66.60588: Flags [P.], seq 5325776:5326016, ack 129, win 502, options [nop,nop,TS val 3494272578 ecr 2826201613], length 240
19:11:34.459082 IP 159.203.57.152.22 > 162.243.190.66.60588: Flags [P.], seq 5326016:5326256, ack 129, win 502, options [nop,nop,TS val 3494272578 ecr 2826201613], length 240
19:11:34.459107 IP 162.243.190.66.60588 > 159.203.57.152.22: Flags [.], ack 5324752, win 501, options [nop,nop,TS val 2826201613 ecr 3494272577], length 0
19:11:34.459154 IP 159.203.57.152.22 > 162.243.190.66.60588: Flags [P.], seq 5326256:5326640, ack 129, win 502, options [nop,nop,TS val 3494272578 ecr 2826201613], length 384
19:11:34.459218 IP 159.203.57.152.22 > 162.243.190.66.60588: Flags [P.], seq 5326640:5326880, ack 129, win 502, options [nop,nop,TS val 3494272578 ecr 2826201613], length 240
19:11:34.459268 IP 159.203.57.152.22 > 162.243.190.66.60588: Flags [P.], seq 5326880:5327120, ack 129, win 502, options [nop,nop,TS val 3494272578 ecr 2826201613], length 240
19:11:34.459319 IP 159.203.57.152.22 > 162.243.190.66.60588: Flags [P.], seq 5327120:5327360, ack 129, win 502, options [nop,nop,TS val 3494272578 ecr 2826201613], length 240
19:11:34.459346 IP 162.243.190.66.60588 > 159.203.57.152.22: Flags [.], ack 5326256, win 501, options [nop,nop,TS val 2826201613 ecr 3494272578], length 0
19:11:34.459409 IP 159.203.57.152.22 > 162.243.190.66.60588: Flags [P.], seq 5327360:5327744, ack 129, win 502, options [nop,nop,TS val 3494272578 ecr 2826201613], length 384
19:11:34.459465 IP 159.203.57.152.22 > 162.243.190.66.60588: Flags [P.], seq 5327744:5327984, ack 129, win 502, options [nop,nop,TS val 3494272578 ecr 2826201613], length 240
19:11:34.459531 IP 159.203.57.152.22 > 162.243.190.66.60588: Flags [P.], seq 5327984:5328224, ack 129, win 502, options [nop,nop,TS val 3494272578 ecr 2826201613], length 240
19:11:34.459593 IP 159.203.57.152.22 > 162.243.190.66.60588: Flags [P.], seq 5328224:5328464, ack 129, win 502, options [nop,nop,TS val 3494272579 ecr 2826201613], length 240
19:11:34.459630 IP 162.243.190.66.60588 > 159.203.57.152.22: Flags [.], ack 5327744, win 501, options [nop,nop,TS val 2826201614 ecr 3494272578], length 0
19:11:34.459668 IP 159.203.57.152.22 > 162.243.190.66.60588: Flags [P.], seq 5328464:5328848, ack 129, win 502, options [nop,nop,TS val 3494272579 ecr 2826201614], length 384
19:11:34.459711 IP 159.203.57.152.22 > 162.243.190.66.60588: Flags [P.], seq 5328848:5329088, ack 129, win 502, options [nop,nop,TS val 3494272579 ecr 2826201614], length 240
19:11:34.459752 IP 159.203.57.152.22 > 162.243.190.66.60588: Flags [P.], seq 5329088:5329328, ack 129, win 502, options [nop,nop,TS val 3494272579 ecr 2826201614], length 240
19:11:34.459791 IP 159.203.57.152.22 > 162.243.190.66.60588: Flags [P.], seq 5329328:5329568, ack 129, win 502, options [nop,nop,TS val 3494272579 ecr 2826201614], length 240
19:11:34.459830 IP 159.203.57.152.22 > 162.243.190.66.60588: Flags [P.], seq 5329568:5329808, ack 129, win 502, options [nop,nop,TS val 3494272579 ecr 2826201614], length 240
19:11:34.459868 IP 159.203.57.152.22 > 162.243.190.66.60588: Flags [P.], seq 5329808:5330048, ack 129, win 502, options [nop,nop,TS val 3494272579 ecr 2826201614], length 240
19:11:34.459910 IP 159.203.57.152.22 > 162.243.190.66.60588: Flags [P.], seq 5330048:5330288, ack 129, win 502, options [nop,nop,TS val 3494272579 ecr 2826201614], length 240
19:11:34.459948 IP 159.203.57.152.22 > 162.243.190.66.60588: Flags [P.], seq 5330288:5330528, ack 129, win 502, options [nop,nop,TS val 3494272579 ecr 2826201614], length 240
19:11:34.459988 IP 159.203.57.152.22 > 162.243.190.66.60588: Flags [P.], seq 5330528:5330768, ack 129, win 502, options [nop,nop,TS val 3494272579 ecr 2826201614], length 240
19:11:34.460026 IP 159.203.57.152.22 > 162.243.190.66.60588: Flags [P.], seq 5330768:5331008, ack 129, win 502, options [nop,nop,TS val 3494272579 ecr 2826201614], length 240
19:11:34.460065 IP 159.203.57.152.22 > 162.243.190.66.60588: Flags [P.], seq 5331008:5331248, ack 129, win 502, options [nop,nop,TS val 3494272579 ecr 2826201614], length 240
19:11:34.460105 IP 159.203.57.152.22 > 162.243.190.66.60588: Flags [P.], seq 5331248:5331488, ack 129, win 502, options [nop,nop,TS val 3494272579 ecr 2826201614], length 240
19:11:34.460144 IP 159.203.57.152.22 > 162.243.190.66.60588: Flags [P.], seq 5331488:5331728, ack 129, win 502, options [nop,nop,TS val 3494272579 ecr 2826201614], length 240
19:11:34.460183 IP 159.203.57.152.22 > 162.243.190.66.60588: Flags [P.], seq 5331728:5331968, ack 129, win 502, options [nop,nop,TS val 3494272579 ecr 2826201614], length 240
19:11:34.460222 IP 159.203.57.152.22 > 162.243.190.66.60588: Flags [P.], seq 5331968:5332208, ack 129, win 502, options [nop,nop,TS val 3494272579 ecr 2826201614], length 240
19:11:34.460260 IP 159.203.57.152.22 > 162.243.190.66.60588: Flags [P.], seq 5332208:5332448, ack 129, win 502, options [nop,nop,TS val 3494272579 ecr 2826201614], length 240
19:11:34.460306 IP 159.203.57.152.22 > 162.243.190.66.60588: Flags [P.], seq 5332448:5332688, ack 129, win 502, options [nop,nop,TS val 3494272579 ecr 2826201614], length 240
19:11:34.460355 IP 159.203.57.152.22 > 162.243.190.66.60588: Flags [P.], seq 5332688:5332928, ack 129, win 502, options [nop,nop,TS val 3494272579 ecr 2826201614], length 240
19:11:34.460399 IP 159.203.57.152.22 > 162.243.190.66.60588: Flags [P.], seq 5332928:5333168, ack 129, win 502, options [nop,nop,TS val 3494272579 ecr 2826201614], length 240
19:11:34.460438 IP 159.203.57.152.22 > 162.243.190.66.60588: Flags [P.], seq 5333168:5333408, ack 129, win 502, options [nop,nop,TS val 3494272579 ecr 2826201614], length 240
19:11:34.460483 IP 159.203.57.152.22 > 162.243.190.66.60588: Flags [P.], seq 5333408:5333648, ack 129, win 502, options [nop,nop,TS val 3494272579 ecr 2826201614], length 240
19:11:34.460521 IP 159.203.57.152.22 > 162.243.190.66.60588: Flags [P.], seq 5333648:5333888, ack 129, win 502, options [nop,nop,TS val 3494272579 ecr 2826201614], length 240
19:11:34.460560 IP 159.203.57.152.22 > 162.243.190.66.60588: Flags [P.], seq 5333888:5334128, ack 129, win 502, options [nop,nop,TS val 3494272579 ecr 2826201614], length 240
19:11:34.460601 IP 159.203.57.152.22 > 162.243.190.66.60588: Flags [P.], seq 5334128:5334368, ack 129, win 502, options [nop,nop,TS val 3494272580 ecr 2826201614], length 240
19:11:34.460642 IP 159.203.57.152.22 > 162.243.190.66.60588: Flags [P.], seq 5334368:5334608, ack 129, win 502, options [nop,nop,TS val 3494272580 ecr 2826201614], length 240
19:11:34.460681 IP 159.203.57.152.22 > 162.243.190.66.60588: Flags [P.], seq 5334608:5334848, ack 129, win 502, options [nop,nop,TS val 3494272580 ecr 2826201614], length 240
19:11:34.460722 IP 159.203.57.152.22 > 162.243.190.66.60588: Flags [P.], seq 5334848:5335088, ack 129, win 502, options [nop,nop,TS val 3494272580 ecr 2826201614], length 240
19:11:34.460761 IP 159.203.57.152.22 > 162.243.190.66.60588: Flags [P.], seq 5335088:5335328, ack 129, win 502, options [nop,nop,TS val 3494272580 ecr 2826201614], length 240
19:11:34.460800 IP 159.203.57.152.22 > 162.243.190.66.60588: Flags [P.], seq 5335328:5335568, ack 129, win 502, options [nop,nop,TS val 3494272580 ecr 2826201614], length 240
19:11:34.460838 IP 159.203.57.152.22 > 162.243.190.66.60588: Flags [P.], seq 5335568:5335808, ack 129, win 502, options [nop,nop,TS val 3494272580 ecr 2826201614], length 240
19:11:34.460879 IP 159.203.57.152.22 > 162.243.190.66.60588: Flags [P.], seq 5335808:5336048, ack 129, win 502, options [nop,nop,TS val 3494272580 ecr 2826201614], length 240
19:11:34.460920 IP 159.203.57.152.22 > 162.243.190.66.60588: Flags [P.], seq 5336048:5336288, ack 129, win 502, options [nop,nop,TS val 3494272580 ecr 2826201614], length 240
19:11:34.460958 IP 159.203.57.152.22 > 162.243.190.66.60588: Flags [P.], seq 5336288:5336528, ack 129, win 502, options [nop,nop,TS val 3494272580 ecr 2826201614], length 240
19:11:34.460996 IP 159.203.57.152.22 > 162.243.190.66.60588: Flags [P.], seq 5336528:5336768, ack 129, win 502, options [nop,nop,TS val 3494272580 ecr 2826201614], length 240
19:11:34.461016 IP 162.243.190.66.60588 > 159.203.57.152.22: Flags [.], ack 5329328, win 501, options [nop,nop,TS val 2826201615 ecr 3494272578], length 0
19:11:34.461028 IP 162.243.190.66.60588 > 159.203.57.152.22: Flags [.], ack 5331008, win 501, options [nop,nop,TS val 2826201615 ecr 3494272579], length 0
19:11:34.461028 IP 162.243.190.66.60588 > 159.203.57.152.22: Flags [.], ack 5332688, win 501, options [nop,nop,TS val 2826201615 ecr 3494272579], length 0
19:11:34.461028 IP 162.243.190.66.60588 > 159.203.57.152.22: Flags [.], ack 5334368, win 501, options [nop,nop,TS val 2826201615 ecr 3494272579], length 0
19:11:34.461095 IP 159.203.57.152.22 > 162.243.190.66.60588: Flags [P.], seq 5336768:5337632, ack 129, win 502, options [nop,nop,TS val 3494272580 ecr 2826201615], length 864
19:11:34.461126 IP 162.243.190.66.60588 > 159.203.57.152.22: Flags [.], ack 5336048, win 501, options [nop,nop,TS val 2826201615 ecr 3494272580], length 0
19:11:34.461156 IP 159.203.57.152.22 > 162.243.190.66.60588: Flags [P.], seq 5337632:5338016, ack 129, win 502, options [nop,nop,TS val 3494272580 ecr 2826201615], length 384
19:11:34.461198 IP 159.203.57.152.22 > 162.243.190.66.60588: Flags [P.], seq 5338016:5338256, ack 129, win 502, options [nop,nop,TS val 3494272580 ecr 2826201615], length 240
19:11:34.461239 IP 159.203.57.152.22 > 162.243.190.66.60588: Flags [P.], seq 5338256:5338496, ack 129, win 502, options [nop,nop,TS val 3494272580 ecr 2826201615], length 240
19:11:34.461283 IP 159.203.57.152.22 > 162.243.190.66.60588: Flags [P.], seq 5338496:5338736, ack 129, win 502, options [nop,nop,TS val 3494272580 ecr 2826201615], length 240
19:11:34.461341 IP 159.203.57.152.22 > 162.243.190.66.60588: Flags [P.], seq 5338736:5338976, ack 129, win 502, options [nop,nop,TS val 3494272580 ecr 2826201615], length 240
19:11:34.461396 IP 159.203.57.152.22 > 162.243.190.66.60588: Flags [P.], seq 5338976:5339216, ack 129, win 502, options [nop,nop,TS val 3494272580 ecr 2826201615], length 240
19:11:34.461454 IP 159.203.57.152.22 > 162.243.190.66.60588: Flags [P.], seq 5339216:5339456, ack 129, win 502, options [nop,nop,TS val 3494272580 ecr 2826201615], length 240
19:11:34.461505 IP 159.203.57.152.22 > 162.243.190.66.60588: Flags [P.], seq 5339456:5339696, ack 129, win 502, options [nop,nop,TS val 3494272580 ecr 2826201615], length 240
19:11:34.461527 IP 162.243.190.66.60588 > 159.203.57.152.22: Flags [.], ack 5337632, win 501, options [nop,nop,TS val 2826201616 ecr 3494272580], length 0
19:11:34.461589 IP 159.203.57.152.22 > 162.243.190.66.60588: Flags [P.], seq 5339696:5340080, ack 129, win 502, options [nop,nop,TS val 3494272581 ecr 2826201616], length 384
19:11:34.461643 IP 159.203.57.152.22 > 162.243.190.66.60588: Flags [P.], seq 5340080:5340320, ack 129, win 502, options [nop,nop,TS val 3494272581 ecr 2826201616], length 240
19:11:34.461715 IP 159.203.57.152.22 > 162.243.190.66.60588: Flags [P.], seq 5340320:5340560, ack 129, win 502, options [nop,nop,TS val 3494272581 ecr 2826201616], length 240
19:11:34.461776 IP 159.203.57.152.22 > 162.243.190.66.60588: Flags [P.], seq 5340560:5340800, ack 129, win 502, options [nop,nop,TS val 3494272581 ecr 2826201616], length 240
19:11:34.461818 IP 159.203.57.152.22 > 162.243.190.66.60588: Flags [P.], seq 5340800:5341040, ack 129, win 502, options [nop,nop,TS val 3494272581 ecr 2826201616], length 240
19:11:34.461857 IP 159.203.57.152.22 > 162.243.190.66.60588: Flags [P.], seq 5341040:5341280, ack 129, win 502, options [nop,nop,TS val 3494272581 ecr 2826201616], length 240
19:11:34.461900 IP 159.203.57.152.22 > 162.243.190.66.60588: Flags [P.], seq 5341280:5341520, ack 129, win 502, options [nop,nop,TS val 3494272581 ecr 2826201616], length 240
19:11:34.461939 IP 159.203.57.152.22 > 162.243.190.66.60588: Flags [P.], seq 5341520:5341760, ack 129, win 502, options [nop,nop,TS val 3494272581 ecr 2826201616], length 240
19:11:34.461981 IP 159.203.57.152.22 > 162.243.190.66.60588: Flags [P.], seq 5341760:5342000, ack 129, win 502, options [nop,nop,TS val 3494272581 ecr 2826201616], length 240
19:11:34.462019 IP 159.203.57.152.22 > 162.243.190.66.60588: Flags [P.], seq 5342000:5342240, ack 129, win 502, options [nop,nop,TS val 3494272581 ecr 2826201616], length 240
19:11:34.462047 IP 162.243.190.66.60588 > 159.203.57.152.22: Flags [.], ack 5339216, win 501, options [nop,nop,TS val 2826201616 ecr 3494272580], length 0
19:11:34.462085 IP 159.203.57.152.22 > 162.243.190.66.60588: Flags [P.], seq 5342240:5342624, ack 129, win 502, options [nop,nop,TS val 3494272581 ecr 2826201616], length 384
19:11:34.462127 IP 159.203.57.152.22 > 162.243.190.66.60588: Flags [P.], seq 5342624:5342864, ack 129, win 502, options [nop,nop,TS val 3494272581 ecr 2826201616], length 240
19:11:34.462167 IP 159.203.57.152.22 > 162.243.190.66.60588: Flags [P.], seq 5342864:5343104, ack 129, win 502, options [nop,nop,TS val 3494272581 ecr 2826201616], length 240
19:11:34.462205 IP 159.203.57.152.22 > 162.243.190.66.60588: Flags [P.], seq 5343104:5343344, ack 129, win 502, options [nop,nop,TS val 3494272581 ecr 2826201616], length 240
19:11:34.462247 IP 159.203.57.152.22 > 162.243.190.66.60588: Flags [P.], seq 5343344:5343584, ack 129, win 502, options [nop,nop,TS val 3494272581 ecr 2826201616], length 240
19:11:34.462297 IP 159.203.57.152.22 > 162.243.190.66.60588: Flags [P.], seq 5343584:5343824, ack 129, win 502, options [nop,nop,TS val 3494272581 ecr 2826201616], length 240
19:11:34.462348 IP 159.203.57.152.22 > 162.243.190.66.60588: Flags [P.], seq 5343824:5344064, ack 129, win 502, options [nop,nop,TS val 3494272581 ecr 2826201616], length 240
19:11:34.462391 IP 159.203.57.152.22 > 162.243.190.66.60588: Flags [P.], seq 5344064:5344304, ack 129, win 502, options [nop,nop,TS val 3494272581 ecr 2826201616], length 240
19:11:34.462430 IP 159.203.57.152.22 > 162.243.190.66.60588: Flags [P.], seq 5344304:5344544, ack 129, win 502, options [nop,nop,TS val 3494272581 ecr 2826201616], length 240
19:11:34.462488 IP 159.203.57.152.22 > 162.243.190.66.60588: Flags [P.], seq 5344544:5344784, ack 129, win 502, options [nop,nop,TS val 3494272581 ecr 2826201616], length 240
19:11:34.462549 IP 159.203.57.152.22 > 162.243.190.66.60588: Flags [P.], seq 5344784:5345024, ack 129, win 502, options [nop,nop,TS val 3494272581 ecr 2826201616], length 240
19:11:34.462592 IP 159.203.57.152.22 > 162.243.190.66.60588: Flags [P.], seq 5345024:5345264, ack 129, win 502, options [nop,nop,TS val 3494272582 ecr 2826201616], length 240
19:11:34.462633 IP 159.203.57.152.22 > 162.243.190.66.60588: Flags [P.], seq 5345264:5345504, ack 129, win 502, options [nop,nop,TS val 3494272582 ecr 2826201616], length 240
19:11:34.462672 IP 159.203.57.152.22 > 162.243.190.66.60588: Flags [P.], seq 5345504:5345744, ack 129, win 502, options [nop,nop,TS val 3494272582 ecr 2826201616], length 240
19:11:34.462712 IP 159.203.57.152.22 > 162.243.190.66.60588: Flags [P.], seq 5345744:5345984, ack 129, win 502, options [nop,nop,TS val 3494272582 ecr 2826201616], length 240
19:11:34.462751 IP 159.203.57.152.22 > 162.243.190.66.60588: Flags [P.], seq 5345984:5346224, ack 129, win 502, options [nop,nop,TS val 3494272582 ecr 2826201616], length 240
19:11:34.462794 IP 159.203.57.152.22 > 162.243.190.66.60588: Flags [P.], seq 5346224:5346464, ack 129, win 502, options [nop,nop,TS val 3494272582 ecr 2826201616], length 240
19:11:34.462853 IP 159.203.57.152.22 > 162.243.190.66.60588: Flags [P.], seq 5346464:5346704, ack 129, win 502, options [nop,nop,TS val 3494272582 ecr 2826201616], length 240
19:11:34.462900 IP 159.203.57.152.22 > 162.243.190.66.60588: Flags [P.], seq 5346704:5346944, ack 129, win 502, options [nop,nop,TS val 3494272582 ecr 2826201616], length 240
19:11:34.462941 IP 159.203.57.152.22 > 162.243.190.66.60588: Flags [P.], seq 5346944:5347184, ack 129, win 502, options [nop,nop,TS val 3494272582 ecr 2826201616], length 240
19:11:34.462980 IP 159.203.57.152.22 > 162.243.190.66.60588: Flags [P.], seq 5347184:5347424, ack 129, win 502, options [nop,nop,TS val 3494272582 ecr 2826201616], length 240
19:11:34.463021 IP 159.203.57.152.22 > 162.243.190.66.60588: Flags [P.], seq 5347424:5347664, ack 129, win 502, options [nop,nop,TS val 3494272582 ecr 2826201616], length 240
19:11:34.463060 IP 159.203.57.152.22 > 162.243.190.66.60588: Flags [P.], seq 5347664:5347904, ack 129, win 502, options [nop,nop,TS val 3494272582 ecr 2826201616], length 240
19:11:34.463116 IP 159.203.57.152.22 > 162.243.190.66.60588: Flags [P.], seq 5347904:5348144, ack 129, win 502, options [nop,nop,TS val 3494272582 ecr 2826201616], length 240
19:11:34.463156 IP 159.203.57.152.22 > 162.243.190.66.60588: Flags [P.], seq 5348144:5348384, ack 129, win 502, options [nop,nop,TS val 3494272582 ecr 2826201616], length 240
19:11:34.463194 IP 159.203.57.152.22 > 162.243.190.66.60588: Flags [P.], seq 5348384:5348624, ack 129, win 502, options [nop,nop,TS val 3494272582 ecr 2826201616], length 240
19:11:34.463234 IP 159.203.57.152.22 > 162.243.190.66.60588: Flags [P.], seq 5348624:5348864, ack 129, win 502, options [nop,nop,TS val 3494272582 ecr 2826201616], length 240
19:11:34.463274 IP 159.203.57.152.22 > 162.243.190.66.60588: Flags [P.], seq 5348864:5349104, ack 129, win 502, options [nop,nop,TS val 3494272582 ecr 2826201616], length 240
19:11:34.463295 IP 162.243.190.66.60588 > 159.203.57.152.22: Flags [.], ack 5340800, win 501, options [nop,nop,TS val 2826201617 ecr 3494272580], length 0
19:11:34.463295 IP 162.243.190.66.60588 > 159.203.57.152.22: Flags [.], ack 5342624, win 501, options [nop,nop,TS val 2826201617 ecr 3494272581], length 0
19:11:34.463295 IP 162.243.190.66.60588 > 159.203.57.152.22: Flags [.], ack 5344304, win 501, options [nop,nop,TS val 2826201617 ecr 3494272581], length 0
19:11:34.463295 IP 162.243.190.66.60588 > 159.203.57.152.22: Flags [.], ack 5345984, win 501, options [nop,nop,TS val 2826201617 ecr 3494272581], length 0
19:11:34.463295 IP 162.243.190.66.60588 > 159.203.57.152.22: Flags [.], ack 5347664, win 501, options [nop,nop,TS val 2826201617 ecr 3494272582], length 0
19:11:34.463402 IP 159.203.57.152.22 > 162.243.190.66.60588: Flags [P.], seq 5349104:5350112, ack 129, win 502, options [nop,nop,TS val 3494272582 ecr 2826201617], length 1008
19:11:34.463443 IP 159.203.57.152.22 > 162.243.190.66.60588: Flags [P.], seq 5350112:5350352, ack 129, win 502, options [nop,nop,TS val 3494272582 ecr 2826201617], length 240
19:11:34.463482 IP 159.203.57.152.22 > 162.243.190.66.60588: Flags [P.], seq 5350352:5350592, ack 129, win 502, options [nop,nop,TS val 3494272582 ecr 2826201617], length 240
19:11:34.463520 IP 159.203.57.152.22 > 162.243.190.66.60588: Flags [P.], seq 5350592:5350832, ack 129, win 502, options [nop,nop,TS val 3494272582 ecr 2826201617], length 240
19:11:34.463561 IP 159.203.57.152.22 > 162.243.190.66.60588: Flags [P.], seq 5350832:5351072, ack 129, win 502, options [nop,nop,TS val 3494272582 ecr 2826201617], length 240
19:11:34.463576 IP 162.243.190.66.60588 > 159.203.57.152.22: Flags [.], ack 5350112, win 501, options [nop,nop,TS val 2826201618 ecr 3494272582], length 0
19:11:34.463619 IP 159.203.57.152.22 > 162.243.190.66.60588: Flags [P.], seq 5351072:5351456, ack 129, win 502, options [nop,nop,TS val 3494272583 ecr 2826201618], length 384
19:11:34.463660 IP 159.203.57.152.22 > 162.243.190.66.60588: Flags [P.], seq 5351456:5351696, ack 129, win 502, options [nop,nop,TS val 3494272583 ecr 2826201618], length 240
19:11:34.463698 IP 159.203.57.152.22 > 162.243.190.66.60588: Flags [P.], seq 5351696:5351936, ack 129, win 502, options [nop,nop,TS val 3494272583 ecr 2826201618], length 240
19:11:34.463738 IP 159.203.57.152.22 > 162.243.190.66.60588: Flags [P.], seq 5351936:5352176, ack 129, win 502, options [nop,nop,TS val 3494272583 ecr 2826201618], length 240
19:11:34.463777 IP 159.203.57.152.22 > 162.243.190.66.60588: Flags [P.], seq 5352176:5352416, ack 129, win 502, options [nop,nop,TS val 3494272583 ecr 2826201618], length 240
19:11:34.463814 IP 159.203.57.152.22 > 162.243.190.66.60588: Flags [P.], seq 5352416:5352656, ack 129, win 502, options [nop,nop,TS val 3494272583 ecr 2826201618], length 240
19:11:34.463853 IP 159.203.57.152.22 > 162.243.190.66.60588: Flags [P.], seq 5352656:5352896, ack 129, win 502, options [nop,nop,TS val 3494272583 ecr 2826201618], length 240
19:11:34.463878 IP 162.243.190.66.60588 > 159.203.57.152.22: Flags [.], ack 5351696, win 501, options [nop,nop,TS val 2826201618 ecr 3494272582], length 0
19:11:34.463913 IP 159.203.57.152.22 > 162.243.190.66.60588: Flags [P.], seq 5352896:5353280, ack 129, win 502, options [nop,nop,TS val 3494272583 ecr 2826201618], length 384
19:11:34.463955 IP 159.203.57.152.22 > 162.243.190.66.60588: Flags [P.], seq 5353280:5353520, ack 129, win 502, options [nop,nop,TS val 3494272583 ecr 2826201618], length 240
19:11:34.463995 IP 159.203.57.152.22 > 162.243.190.66.60588: Flags [P.], seq 5353520:5353760, ack 129, win 502, options [nop,nop,TS val 3494272583 ecr 2826201618], length 240
19:11:34.464037 IP 159.203.57.152.22 > 162.243.190.66.60588: Flags [P.], seq 5353760:5354000, ack 129, win 502, options [nop,nop,TS val 3494272583 ecr 2826201618], length 240
19:11:34.464075 IP 159.203.57.152.22 > 162.243.190.66.60588: Flags [P.], seq 5354000:5354240, ack 129, win 502, options [nop,nop,TS val 3494272583 ecr 2826201618], length 240
19:11:34.464113 IP 159.203.57.152.22 > 162.243.190.66.60588: Flags [P.], seq 5354240:5354480, ack 129, win 502, options [nop,nop,TS val 3494272583 ecr 2826201618], length 240
19:11:34.464153 IP 159.203.57.152.22 > 162.243.190.66.60588: Flags [P.], seq 5354480:5354720, ack 129, win 502, options [nop,nop,TS val 3494272583 ecr 2826201618], length 240
19:11:34.464192 IP 159.203.57.152.22 > 162.243.190.66.60588: Flags [P.], seq 5354720:5354960, ack 129, win 502, options [nop,nop,TS val 3494272583 ecr 2826201618], length 240
19:11:34.464233 IP 159.203.57.152.22 > 162.243.190.66.60588: Flags [P.], seq 5354960:5355200, ack 129, win 502, options [nop,nop,TS val 3494272583 ecr 2826201618], length 240
19:11:34.464254 IP 162.243.190.66.60588 > 159.203.57.152.22: Flags [.], ack 5354000, win 501, options [nop,nop,TS val 2826201618 ecr 3494272583], length 0
19:11:34.464292 IP 159.203.57.152.22 > 162.243.190.66.60588: Flags [P.], seq 5355200:5355584, ack 129, win 502, options [nop,nop,TS val 3494272583 ecr 2826201618], length 384
19:11:34.464346 IP 159.203.57.152.22 > 162.243.190.66.60588: Flags [P.], seq 5355584:5355824, ack 129, win 502, options [nop,nop,TS val 3494272583 ecr 2826201618], length 240
19:11:34.464390 IP 159.203.57.152.22 > 162.243.190.66.60588: Flags [P.], seq 5355824:5356064, ack 129, win 502, options [nop,nop,TS val 3494272583 ecr 2826201618], length 240
19:11:34.464435 IP 159.203.57.152.22 > 162.243.190.66.60588: Flags [P.], seq 5356064:5356304, ack 129, win 502, options [nop,nop,TS val 3494272583 ecr 2826201618], length 240
19:11:34.464491 IP 159.203.57.152.22 > 162.243.190.66.60588: Flags [P.], seq 5356304:5356544, ack 129, win 502, options [nop,nop,TS val 3494272583 ecr 2826201618], length 240
19:11:34.464542 IP 159.203.57.152.22 > 162.243.190.66.60588: Flags [P.], seq 5356544:5356784, ack 129, win 502, options [nop,nop,TS val 3494272583 ecr 2826201618], length 240
19:11:34.464669 IP 159.203.57.152.22 > 162.243.190.66.60588: Flags [P.], seq 5356784:5357024, ack 129, win 502, options [nop,nop,TS val 3494272584 ecr 2826201618], length 240
19:11:34.464739 IP 159.203.57.152.22 > 162.243.190.66.60588: Flags [P.], seq 5357024:5357264, ack 129, win 502, options [nop,nop,TS val 3494272584 ecr 2826201618], length 240
19:11:34.464792 IP 162.243.190.66.60588 > 159.203.57.152.22: Flags [.], ack 5355824, win 501, options [nop,nop,TS val 2826201619 ecr 3494272583], length 0
19:11:34.464818 IP 159.203.57.152.22 > 162.243.190.66.60588: Flags [P.], seq 5357264:5357504, ack 129, win 502, options [nop,nop,TS val 3494272584 ecr 2826201619], length 240
19:11:34.464870 IP 159.203.57.152.22 > 162.243.190.66.60588: Flags [P.], seq 5357504:5357888, ack 129, win 502, options [nop,nop,TS val 3494272584 ecr 2826201619], length 384
19:11:34.464909 IP 159.203.57.152.22 > 162.243.190.66.60588: Flags [P.], seq 5357888:5358128, ack 129, win 502, options [nop,nop,TS val 3494272584 ecr 2826201619], length 240
19:11:34.464948 IP 159.203.57.152.22 > 162.243.190.66.60588: Flags [P.], seq 5358128:5358368, ack 129, win 502, options [nop,nop,TS val 3494272584 ecr 2826201619], length 240
19:11:34.464986 IP 159.203.57.152.22 > 162.243.190.66.60588: Flags [P.], seq 5358368:5358608, ack 129, win 502, options [nop,nop,TS val 3494272584 ecr 2826201619], length 240
19:11:34.464996 IP 162.243.190.66.60588 > 159.203.57.152.22: Flags [.], ack 5357504, win 501, options [nop,nop,TS val 2826201619 ecr 3494272583], length 0
19:11:34.465046 IP 159.203.57.152.22 > 162.243.190.66.60588: Flags [P.], seq 5358608:5358992, ack 129, win 502, options [nop,nop,TS val 3494272584 ecr 2826201619], length 384
19:11:34.465085 IP 159.203.57.152.22 > 162.243.190.66.60588: Flags [P.], seq 5358992:5359232, ack 129, win 502, options [nop,nop,TS val 3494272584 ecr 2826201619], length 240
19:11:34.465123 IP 159.203.57.152.22 > 162.243.190.66.60588: Flags [P.], seq 5359232:5359472, ack 129, win 502, options [nop,nop,TS val 3494272584 ecr 2826201619], length 240
19:11:34.465161 IP 159.203.57.152.22 > 162.243.190.66.60588: Flags [P.], seq 5359472:5359712, ack 129, win 502, options [nop,nop,TS val 3494272584 ecr 2826201619], length 240
19:11:34.465208 IP 159.203.57.152.22 > 162.243.190.66.60588: Flags [P.], seq 5359712:5359952, ack 129, win 502, options [nop,nop,TS val 3494272584 ecr 2826201619], length 240
19:11:34.465271 IP 159.203.57.152.22 > 162.243.190.66.60588: Flags [P.], seq 5359952:5360192, ack 129, win 502, options [nop,nop,TS val 3494272584 ecr 2826201619], length 240
19:11:34.465330 IP 159.203.57.152.22 > 162.243.190.66.60588: Flags [P.], seq 5360192:5360432, ack 129, win 502, options [nop,nop,TS val 3494272584 ecr 2826201619], length 240
19:11:34.465373 IP 159.203.57.152.22 > 162.243.190.66.60588: Flags [P.], seq 5360432:5360672, ack 129, win 502, options [nop,nop,TS val 3494272584 ecr 2826201619], length 240
19:11:34.465414 IP 159.203.57.152.22 > 162.243.190.66.60588: Flags [P.], seq 5360672:5360912, ack 129, win 502, options [nop,nop,TS val 3494272584 ecr 2826201619], length 240
19:11:34.465452 IP 159.203.57.152.22 > 162.243.190.66.60588: Flags [P.], seq 5360912:5361152, ack 129, win 502, options [nop,nop,TS val 3494272584 ecr 2826201619], length 240
19:11:34.465492 IP 159.203.57.152.22 > 162.243.190.66.60588: Flags [P.], seq 5361152:5361392, ack 129, win 502, options [nop,nop,TS val 3494272584 ecr 2826201619], length 240
19:11:34.465531 IP 159.203.57.152.22 > 162.243.190.66.60588: Flags [P.], seq 5361392:5361632, ack 129, win 502, options [nop,nop,TS val 3494272584 ecr 2826201619], length 240
19:11:34.465569 IP 159.203.57.152.22 > 162.243.190.66.60588: Flags [P.], seq 5361632:5361872, ack 129, win 502, options [nop,nop,TS val 3494272584 ecr 2826201619], length 240
19:11:34.465610 IP 159.203.57.152.22 > 162.243.190.66.60588: Flags [P.], seq 5361872:5362112, ack 129, win 502, options [nop,nop,TS val 3494272585 ecr 2826201619], length 240
19:11:34.465656 IP 159.203.57.152.22 > 162.243.190.66.60588: Flags [P.], seq 5362112:5362352, ack 129, win 502, options [nop,nop,TS val 3494272585 ecr 2826201619], length 240
19:11:34.465733 IP 159.203.57.152.22 > 162.243.190.66.60588: Flags [P.], seq 5362352:5362592, ack 129, win 502, options [nop,nop,TS val 3494272585 ecr 2826201619], length 240
19:11:34.465781 IP 159.203.57.152.22 > 162.243.190.66.60588: Flags [P.], seq 5362592:5362832, ack 129, win 502, options [nop,nop,TS val 3494272585 ecr 2826201619], length 240
19:11:34.465823 IP 159.203.57.152.22 > 162.243.190.66.60588: Flags [P.], seq 5362832:5363072, ack 129, win 502, options [nop,nop,TS val 3494272585 ecr 2826201619], length 240
19:11:34.465864 IP 159.203.57.152.22 > 162.243.190.66.60588: Flags [P.], seq 5363072:5363312, ack 129, win 502, options [nop,nop,TS val 3494272585 ecr 2826201619], length 240
19:11:34.465903 IP 159.203.57.152.22 > 162.243.190.66.60588: Flags [P.], seq 5363312:5363552, ack 129, win 502, options [nop,nop,TS val 3494272585 ecr 2826201619], length 240
19:11:34.465967 IP 159.203.57.152.22 > 162.243.190.66.60588: Flags [P.], seq 5363552:5363792, ack 129, win 502, options [nop,nop,TS val 3494272585 ecr 2826201619], length 240
19:11:34.466029 IP 159.203.57.152.22 > 162.243.190.66.60588: Flags [P.], seq 5363792:5364032, ack 129, win 502, options [nop,nop,TS val 3494272585 ecr 2826201619], length 240
19:11:34.466054 IP 162.243.190.66.60588 > 159.203.57.152.22: Flags [.], ack 5359952, win 501, options [nop,nop,TS val 2826201620 ecr 3494272584], length 0
19:11:34.466054 IP 162.243.190.66.60588 > 159.203.57.152.22: Flags [.], ack 5361872, win 501, options [nop,nop,TS val 2826201620 ecr 3494272584], length 0
19:11:34.466138 IP 159.203.57.152.22 > 162.243.190.66.60588: Flags [P.], seq 5364032:5364576, ack 129, win 502, options [nop,nop,TS val 3494272585 ecr 2826201620], length 544
19:11:34.466164 IP 162.243.190.66.60588 > 159.203.57.152.22: Flags [.], ack 5363552, win 501, options [nop,nop,TS val 2826201620 ecr 3494272585], length 0
19:11:34.466223 IP 159.203.57.152.22 > 162.243.190.66.60588: Flags [P.], seq 5364576:5364960, ack 129, win 502, options [nop,nop,TS val 3494272585 ecr 2826201620], length 384
19:11:34.466304 IP 159.203.57.152.22 > 162.243.190.66.60588: Flags [P.], seq 5364960:5365200, ack 129, win 502, options [nop,nop,TS val 3494272585 ecr 2826201620], length 240
19:11:34.466352 IP 159.203.57.152.22 > 162.243.190.66.60588: Flags [P.], seq 5365200:5365440, ack 129, win 502, options [nop,nop,TS val 3494272585 ecr 2826201620], length 240
19:11:34.466393 IP 159.203.57.152.22 > 162.243.190.66.60588: Flags [P.], seq 5365440:5365680, ack 129, win 502, options [nop,nop,TS val 3494272585 ecr 2826201620], length 240
19:11:34.466433 IP 159.203.57.152.22 > 162.243.190.66.60588: Flags [P.], seq 5365680:5365920, ack 129, win 502, options [nop,nop,TS val 3494272585 ecr 2826201620], length 240
19:11:34.466473 IP 159.203.57.152.22 > 162.243.190.66.60588: Flags [P.], seq 5365920:5366160, ack 129, win 502, options [nop,nop,TS val 3494272585 ecr 2826201620], length 240
19:11:34.466512 IP 159.203.57.152.22 > 162.243.190.66.60588: Flags [P.], seq 5366160:5366400, ack 129, win 502, options [nop,nop,TS val 3494272585 ecr 2826201620], length 240
19:11:34.466551 IP 159.203.57.152.22 > 162.243.190.66.60588: Flags [P.], seq 5366400:5366640, ack 129, win 502, options [nop,nop,TS val 3494272585 ecr 2826201620], length 240
19:11:34.466591 IP 159.203.57.152.22 > 162.243.190.66.60588: Flags [P.], seq 5366640:5366880, ack 129, win 502, options [nop,nop,TS val 3494272586 ecr 2826201620], length 240
19:11:34.466629 IP 159.203.57.152.22 > 162.243.190.66.60588: Flags [P.], seq 5366880:5367120, ack 129, win 502, options [nop,nop,TS val 3494272586 ecr 2826201620], length 240
19:11:34.466668 IP 159.203.57.152.22 > 162.243.190.66.60588: Flags [P.], seq 5367120:5367360, ack 129, win 502, options [nop,nop,TS val 3494272586 ecr 2826201620], length 240
19:11:34.466706 IP 159.203.57.152.22 > 162.243.190.66.60588: Flags [P.], seq 5367360:5367600, ack 129, win 502, options [nop,nop,TS val 3494272586 ecr 2826201620], length 240
19:11:34.466744 IP 159.203.57.152.22 > 162.243.190.66.60588: Flags [P.], seq 5367600:5367840, ack 129, win 502, options [nop,nop,TS val 3494272586 ecr 2826201620], length 240
19:11:34.466784 IP 159.203.57.152.22 > 162.243.190.66.60588: Flags [P.], seq 5367840:5368080, ack 129, win 502, options [nop,nop,TS val 3494272586 ecr 2826201620], length 240
19:11:34.466825 IP 159.203.57.152.22 > 162.243.190.66.60588: Flags [P.], seq 5368080:5368320, ack 129, win 502, options [nop,nop,TS val 3494272586 ecr 2826201620], length 240
19:11:34.466865 IP 159.203.57.152.22 > 162.243.190.66.60588: Flags [P.], seq 5368320:5368560, ack 129, win 502, options [nop,nop,TS val 3494272586 ecr 2826201620], length 240
19:11:34.466906 IP 159.203.57.152.22 > 162.243.190.66.60588: Flags [P.], seq 5368560:5368800, ack 129, win 502, options [nop,nop,TS val 3494272586 ecr 2826201620], length 240
19:11:34.466944 IP 159.203.57.152.22 > 162.243.190.66.60588: Flags [P.], seq 5368800:5369040, ack 129, win 502, options [nop,nop,TS val 3494272586 ecr 2826201620], length 240
19:11:34.466982 IP 159.203.57.152.22 > 162.243.190.66.60588: Flags [P.], seq 5369040:5369280, ack 129, win 502, options [nop,nop,TS val 3494272586 ecr 2826201620], length 240
19:11:34.467033 IP 159.203.57.152.22 > 162.243.190.66.60588: Flags [P.], seq 5369280:5369520, ack 129, win 502, options [nop,nop,TS val 3494272586 ecr 2826201620], length 240
19:11:34.467114 IP 159.203.57.152.22 > 162.243.190.66.60588: Flags [P.], seq 5369520:5369760, ack 129, win 502, options [nop,nop,TS val 3494272586 ecr 2826201620], length 240
19:11:34.467172 IP 159.203.57.152.22 > 162.243.190.66.60588: Flags [P.], seq 5369760:5370000, ack 129, win 502, options [nop,nop,TS val 3494272586 ecr 2826201620], length 240
19:11:34.467227 IP 159.203.57.152.22 > 162.243.190.66.60588: Flags [P.], seq 5370000:5370240, ack 129, win 502, options [nop,nop,TS val 3494272586 ecr 2826201620], length 240
19:11:34.467285 IP 159.203.57.152.22 > 162.243.190.66.60588: Flags [P.], seq 5370240:5370480, ack 129, win 502, options [nop,nop,TS val 3494272586 ecr 2826201620], length 240
19:11:34.467340 IP 159.203.57.152.22 > 162.243.190.66.60588: Flags [P.], seq 5370480:5370720, ack 129, win 502, options [nop,nop,TS val 3494272586 ecr 2826201620], length 240
19:11:34.467402 IP 159.203.57.152.22 > 162.243.190.66.60588: Flags [P.], seq 5370720:5370960, ack 129, win 502, options [nop,nop,TS val 3494272586 ecr 2826201620], length 240
19:11:34.467453 IP 159.203.57.152.22 > 162.243.190.66.60588: Flags [P.], seq 5370960:5371200, ack 129, win 502, options [nop,nop,TS val 3494272586 ecr 2826201620], length 240
19:11:34.467493 IP 159.203.57.152.22 > 162.243.190.66.60588: Flags [P.], seq 5371200:5371440, ack 129, win 502, options [nop,nop,TS val 3494272586 ecr 2826201620], length 240
19:11:34.467509 IP 162.243.190.66.60588 > 159.203.57.152.22: Flags [.], ack 5365200, win 501, options [nop,nop,TS val 2826201622 ecr 3494272585], length 0
19:11:34.467509 IP 162.243.190.66.60588 > 159.203.57.152.22: Flags [.], ack 5367120, win 501, options [nop,nop,TS val 2826201622 ecr 3494272585], length 0
19:11:34.467546 IP 162.243.190.66.60588 > 159.203.57.152.22: Flags [.], ack 5370240, win 501, options [nop,nop,TS val 2826201622 ecr 3494272586], length 0
19:11:34.467611 IP 159.203.57.152.22 > 162.243.190.66.60588: Flags [P.], seq 5371440:5372144, ack 129, win 502, options [nop,nop,TS val 3494272587 ecr 2826201622], length 704
19:11:34.467650 IP 159.203.57.152.22 > 162.243.190.66.60588: Flags [P.], seq 5372144:5372384, ack 129, win 502, options [nop,nop,TS val 3494272587 ecr 2826201622], length 240
19:11:34.467690 IP 159.203.57.152.22 > 162.243.190.66.60588: Flags [P.], seq 5372384:5372624, ack 129, win 502, options [nop,nop,TS val 3494272587 ecr 2826201622], length 240
19:11:34.467728 IP 159.203.57.152.22 > 162.243.190.66.60588: Flags [P.], seq 5372624:5372864, ack 129, win 502, options [nop,nop,TS val 3494272587 ecr 2826201622], length 240
19:11:34.467769 IP 162.243.190.66.60588 > 159.203.57.152.22: Flags [.], ack 5372144, win 501, options [nop,nop,TS val 2826201622 ecr 3494272586], length 0
19:11:34.467790 IP 159.203.57.152.22 > 162.243.190.66.60588: Flags [P.], seq 5372864:5373104, ack 129, win 502, options [nop,nop,TS val 3494272587 ecr 2826201622], length 240
19:11:34.467829 IP 159.203.57.152.22 > 162.243.190.66.60588: Flags [P.], seq 5373104:5373488, ack 129, win 502, options [nop,nop,TS val 3494272587 ecr 2826201622], length 384
19:11:34.467878 IP 159.203.57.152.22 > 162.243.190.66.60588: Flags [P.], seq 5373488:5373728, ack 129, win 502, options [nop,nop,TS val 3494272587 ecr 2826201622], length 240
19:11:34.467936 IP 159.203.57.152.22 > 162.243.190.66.60588: Flags [P.], seq 5373728:5373968, ack 129, win 502, options [nop,nop,TS val 3494272587 ecr 2826201622], length 240
19:11:34.467983 IP 159.203.57.152.22 > 162.243.190.66.60588: Flags [P.], seq 5373968:5374208, ack 129, win 502, options [nop,nop,TS val 3494272587 ecr 2826201622], length 240
19:11:34.468023 IP 159.203.57.152.22 > 162.243.190.66.60588: Flags [P.], seq 5374208:5374448, ack 129, win 502, options [nop,nop,TS val 3494272587 ecr 2826201622], length 240
19:11:34.468062 IP 159.203.57.152.22 > 162.243.190.66.60588: Flags [P.], seq 5374448:5374688, ack 129, win 502, options [nop,nop,TS val 3494272587 ecr 2826201622], length 240
19:11:34.468103 IP 159.203.57.152.22 > 162.243.190.66.60588: Flags [P.], seq 5374688:5374928, ack 129, win 502, options [nop,nop,TS val 3494272587 ecr 2826201622], length 240
19:11:34.468143 IP 159.203.57.152.22 > 162.243.190.66.60588: Flags [P.], seq 5374928:5375168, ack 129, win 502, options [nop,nop,TS val 3494272587 ecr 2826201622], length 240
19:11:34.468185 IP 159.203.57.152.22 > 162.243.190.66.60588: Flags [P.], seq 5375168:5375408, ack 129, win 502, options [nop,nop,TS val 3494272587 ecr 2826201622], length 240
19:11:34.468200 IP 162.243.190.66.60588 > 159.203.57.152.22: Flags [.], ack 5373728, win 501, options [nop,nop,TS val 2826201622 ecr 3494272587], length 0
19:11:34.468254 IP 159.203.57.152.22 > 162.243.190.66.60588: Flags [P.], seq 5375408:5375792, ack 129, win 502, options [nop,nop,TS val 3494272587 ecr 2826201622], length 384
19:11:34.468316 IP 159.203.57.152.22 > 162.243.190.66.60588: Flags [P.], seq 5375792:5376032, ack 129, win 502, options [nop,nop,TS val 3494272587 ecr 2826201622], length 240
19:11:34.468362 IP 159.203.57.152.22 > 162.243.190.66.60588: Flags [P.], seq 5376032:5376272, ack 129, win 502, options [nop,nop,TS val 3494272587 ecr 2826201622], length 240
19:11:34.468410 IP 159.203.57.152.22 > 162.243.190.66.60588: Flags [P.], seq 5376272:5376512, ack 129, win 502, options [nop,nop,TS val 3494272587 ecr 2826201622], length 240
19:11:34.468432 IP 162.243.190.66.60588 > 159.203.57.152.22: Flags [.], ack 5375408, win 501, options [nop,nop,TS val 2826201623 ecr 3494272587], length 0
19:11:34.468476 IP 159.203.57.152.22 > 162.243.190.66.60588: Flags [P.], seq 5376512:5376896, ack 129, win 502, options [nop,nop,TS val 3494272587 ecr 2826201623], length 384
19:11:34.468515 IP 159.203.57.152.22 > 162.243.190.66.60588: Flags [P.], seq 5376896:5377136, ack 129, win 502, options [nop,nop,TS val 3494272587 ecr 2826201623], length 240
19:11:34.468558 IP 159.203.57.152.22 > 162.243.190.66.60588: Flags [P.], seq 5377136:5377376, ack 129, win 502, options [nop,nop,TS val 3494272587 ecr 2826201623], length 240
19:11:34.468623 IP 159.203.57.152.22 > 162.243.190.66.60588: Flags [P.], seq 5377376:5377616, ack 129, win 502, options [nop,nop,TS val 3494272588 ecr 2826201623], length 240
19:11:34.468681 IP 162.243.190.66.60588 > 159.203.57.152.22: Flags [.], ack 5376896, win 501, options [nop,nop,TS val 2826201623 ecr 3494272587], length 0
19:11:34.468719 IP 159.203.57.152.22 > 162.243.190.66.60588: Flags [P.], seq 5377616:5377856, ack 129, win 502, options [nop,nop,TS val 3494272588 ecr 2826201623], length 240
19:11:34.468740 IP 159.203.57.152.22 > 162.243.190.66.60588: Flags [P.], seq 5377856:5378064, ack 129, win 502, options [nop,nop,TS val 3494272588 ecr 2826201623], length 208
19:11:34.468783 IP 159.203.57.152.22 > 162.243.190.66.60588: Flags [P.], seq 5378064:5378480, ack 129, win 502, options [nop,nop,TS val 3494272588 ecr 2826201623], length 416
19:11:34.468920 IP 159.203.57.152.22 > 162.243.190.66.60588: Flags [P.], seq 5378480:5378720, ack 129, win 502, options [nop,nop,TS val 3494272588 ecr 2826201623], length 240
19:11:34.468975 IP 159.203.57.152.22 > 162.243.190.66.60588: Flags [P.], seq 5378720:5378960, ack 129, win 502, options [nop,nop,TS val 3494272588 ecr 2826201623], length 240
19:11:34.469016 IP 159.203.57.152.22 > 162.243.190.66.60588: Flags [P.], seq 5378960:5379200, ack 129, win 502, options [nop,nop,TS val 3494272588 ecr 2826201623], length 240
19:11:34.469055 IP 159.203.57.152.22 > 162.243.190.66.60588: Flags [P.], seq 5379200:5379440, ack 129, win 502, options [nop,nop,TS val 3494272588 ecr 2826201623], length 240
19:11:34.469071 IP 162.243.190.66.60588 > 159.203.57.152.22: Flags [.], ack 5378480, win 501, options [nop,nop,TS val 2826201623 ecr 3494272587], length 0
19:11:34.469119 IP 159.203.57.152.22 > 162.243.190.66.60588: Flags [P.], seq 5379440:5379824, ack 129, win 502, options [nop,nop,TS val 3494272588 ecr 2826201623], length 384
19:11:34.469181 IP 159.203.57.152.22 > 162.243.190.66.60588: Flags [P.], seq 5379824:5380064, ack 129, win 502, options [nop,nop,TS val 3494272588 ecr 2826201623], length 240
19:11:34.469245 IP 159.203.57.152.22 > 162.243.190.66.60588: Flags [P.], seq 5380064:5380304, ack 129, win 502, options [nop,nop,TS val 3494272588 ecr 2826201623], length 240
19:11:34.469290 IP 159.203.57.152.22 > 162.243.190.66.60588: Flags [P.], seq 5380304:5380544, ack 129, win 502, options [nop,nop,TS val 3494272588 ecr 2826201623], length 240
19:11:34.469335 IP 159.203.57.152.22 > 162.243.190.66.60588: Flags [P.], seq 5380544:5380784, ack 129, win 502, options [nop,nop,TS val 3494272588 ecr 2826201623], length 240
19:11:34.469377 IP 159.203.57.152.22 > 162.243.190.66.60588: Flags [P.], seq 5380784:5381024, ack 129, win 502, options [nop,nop,TS val 3494272588 ecr 2826201623], length 240
19:11:34.469416 IP 159.203.57.152.22 > 162.243.190.66.60588: Flags [P.], seq 5381024:5381264, ack 129, win 502, options [nop,nop,TS val 3494272588 ecr 2826201623], length 240
19:11:34.469458 IP 159.203.57.152.22 > 162.243.190.66.60588: Flags [P.], seq 5381264:5381504, ack 129, win 502, options [nop,nop,TS val 3494272588 ecr 2826201623], length 240
19:11:34.469499 IP 159.203.57.152.22 > 162.243.190.66.60588: Flags [P.], seq 5381504:5381744, ack 129, win 502, options [nop,nop,TS val 3494272588 ecr 2826201623], length 240
19:11:34.469539 IP 159.203.57.152.22 > 162.243.190.66.60588: Flags [P.], seq 5381744:5381984, ack 129, win 502, options [nop,nop,TS val 3494272588 ecr 2826201623], length 240
19:11:34.469581 IP 159.203.57.152.22 > 162.243.190.66.60588: Flags [P.], seq 5381984:5382224, ack 129, win 502, options [nop,nop,TS val 3494272589 ecr 2826201623], length 240
19:11:34.469620 IP 159.203.57.152.22 > 162.243.190.66.60588: Flags [P.], seq 5382224:5382464, ack 129, win 502, options [nop,nop,TS val 3494272589 ecr 2826201623], length 240
19:11:34.469659 IP 159.203.57.152.22 > 162.243.190.66.60588: Flags [P.], seq 5382464:5382704, ack 129, win 502, options [nop,nop,TS val 3494272589 ecr 2826201623], length 240
19:11:34.469739 IP 159.203.57.152.22 > 162.243.190.66.60588: Flags [P.], seq 5382704:5382944, ack 129, win 502, options [nop,nop,TS val 3494272589 ecr 2826201623], length 240
19:11:34.469781 IP 159.203.57.152.22 > 162.243.190.66.60588: Flags [P.], seq 5382944:5383184, ack 129, win 502, options [nop,nop,TS val 3494272589 ecr 2826201623], length 240
19:11:34.469843 IP 159.203.57.152.22 > 162.243.190.66.60588: Flags [P.], seq 5383184:5383424, ack 129, win 502, options [nop,nop,TS val 3494272589 ecr 2826201623], length 240
19:11:34.469888 IP 159.203.57.152.22 > 162.243.190.66.60588: Flags [P.], seq 5383424:5383664, ack 129, win 502, options [nop,nop,TS val 3494272589 ecr 2826201623], length 240
19:11:34.469943 IP 159.203.57.152.22 > 162.243.190.66.60588: Flags [P.], seq 5383664:5383904, ack 129, win 502, options [nop,nop,TS val 3494272589 ecr 2826201623], length 240
19:11:34.469993 IP 159.203.57.152.22 > 162.243.190.66.60588: Flags [P.], seq 5383904:5384144, ack 129, win 502, options [nop,nop,TS val 3494272589 ecr 2826201623], length 240
19:11:34.470047 IP 159.203.57.152.22 > 162.243.190.66.60588: Flags [P.], seq 5384144:5384384, ack 129, win 502, options [nop,nop,TS val 3494272589 ecr 2826201623], length 240
19:11:34.470100 IP 159.203.57.152.22 > 162.243.190.66.60588: Flags [P.], seq 5384384:5384624, ack 129, win 502, options [nop,nop,TS val 3494272589 ecr 2826201623], length 240
19:11:34.470168 IP 159.203.57.152.22 > 162.243.190.66.60588: Flags [P.], seq 5384624:5384864, ack 129, win 502, options [nop,nop,TS val 3494272589 ecr 2826201623], length 240
19:11:34.470236 IP 162.243.190.66.60588 > 159.203.57.152.22: Flags [.], ack 5380064, win 501, options [nop,nop,TS val 2826201624 ecr 3494272588], length 0
19:11:34.470236 IP 162.243.190.66.60588 > 159.203.57.152.22: Flags [.], ack 5381744, win 501, options [nop,nop,TS val 2826201624 ecr 3494272588], length 0
19:11:34.470237 IP 162.243.190.66.60588 > 159.203.57.152.22: Flags [.], ack 5383424, win 501, options [nop,nop,TS val 2826201624 ecr 3494272588], length 0
19:11:34.470303 IP 159.203.57.152.22 > 162.243.190.66.60588: Flags [P.], seq 5384864:5385104, ack 129, win 502, options [nop,nop,TS val 3494272589 ecr 2826201624], length 240
19:11:34.470328 IP 159.203.57.152.22 > 162.243.190.66.60588: Flags [P.], seq 5385104:5385632, ack 129, win 502, options [nop,nop,TS val 3494272589 ecr 2826201624], length 528
19:11:34.470377 IP 159.203.57.152.22 > 162.243.190.66.60588: Flags [P.], seq 5385632:5386048, ack 129, win 502, options [nop,nop,TS val 3494272589 ecr 2826201624], length 416
19:11:34.470415 IP 159.203.57.152.22 > 162.243.190.66.60588: Flags [P.], seq 5386048:5386288, ack 129, win 502, options [nop,nop,TS val 3494272589 ecr 2826201624], length 240
19:11:34.470454 IP 162.243.190.66.60588 > 159.203.57.152.22: Flags [.], ack 5385104, win 501, options [nop,nop,TS val 2826201625 ecr 3494272589], length 0
19:11:34.470481 IP 159.203.57.152.22 > 162.243.190.66.60588: Flags [P.], seq 5386288:5386528, ack 129, win 502, options [nop,nop,TS val 3494272589 ecr 2826201625], length 240
19:11:34.470518 IP 159.203.57.152.22 > 162.243.190.66.60588: Flags [P.], seq 5386528:5386736, ack 129, win 502, options [nop,nop,TS val 3494272589 ecr 2826201625], length 208
19:11:34.470540 IP 159.203.57.152.22 > 162.243.190.66.60588: Flags [P.], seq 5386736:5386976, ack 129, win 502, options [nop,nop,TS val 3494272589 ecr 2826201625], length 240
19:11:34.470588 IP 159.203.57.152.22 > 162.243.190.66.60588: Flags [P.], seq 5386976:5387392, ack 129, win 502, options [nop,nop,TS val 3494272590 ecr 2826201625], length 416
19:11:34.470629 IP 159.203.57.152.22 > 162.243.190.66.60588: Flags [P.], seq 5387392:5387632, ack 129, win 502, options [nop,nop,TS val 3494272590 ecr 2826201625], length 240
19:11:34.470690 IP 159.203.57.152.22 > 162.243.190.66.60588: Flags [P.], seq 5387632:5387872, ack 129, win 502, options [nop,nop,TS val 3494272590 ecr 2826201625], length 240
19:11:34.470742 IP 159.203.57.152.22 > 162.243.190.66.60588: Flags [P.], seq 5387872:5388112, ack 129, win 502, options [nop,nop,TS val 3494272590 ecr 2826201625], length 240
19:11:34.470784 IP 159.203.57.152.22 > 162.243.190.66.60588: Flags [P.], seq 5388112:5388352, ack 129, win 502, options [nop,nop,TS val 3494272590 ecr 2826201625], length 240
19:11:34.470824 IP 159.203.57.152.22 > 162.243.190.66.60588: Flags [P.], seq 5388352:5388592, ack 129, win 502, options [nop,nop,TS val 3494272590 ecr 2826201625], length 240
19:11:34.470867 IP 159.203.57.152.22 > 162.243.190.66.60588: Flags [P.], seq 5388592:5388832, ack 129, win 502, options [nop,nop,TS val 3494272590 ecr 2826201625], length 240
19:11:34.470907 IP 159.203.57.152.22 > 162.243.190.66.60588: Flags [P.], seq 5388832:5389072, ack 129, win 502, options [nop,nop,TS val 3494272590 ecr 2826201625], length 240
19:11:34.470947 IP 162.243.190.66.60588 > 159.203.57.152.22: Flags [.], ack 5386736, win 501, options [nop,nop,TS val 2826201625 ecr 3494272589], length 0
19:11:34.470976 IP 159.203.57.152.22 > 162.243.190.66.60588: Flags [P.], seq 5389072:5389312, ack 129, win 502, options [nop,nop,TS val 3494272590 ecr 2826201625], length 240
19:11:34.470985 IP 162.243.190.66.60588 > 159.203.57.152.22: Flags [.], ack 5388592, win 501, options [nop,nop,TS val 2826201625 ecr 3494272589], length 0
19:11:34.471003 IP 159.203.57.152.22 > 162.243.190.66.60588: Flags [P.], seq 5389312:5389520, ack 129, win 502, options [nop,nop,TS val 3494272590 ecr 2826201625], length 208
19:11:34.471088 IP 159.203.57.152.22 > 162.243.190.66.60588: Flags [P.], seq 5389520:5390080, ack 129, win 502, options [nop,nop,TS val 3494272590 ecr 2826201625], length 560
19:11:34.471137 IP 159.203.57.152.22 > 162.243.190.66.60588: Flags [P.], seq 5390080:5390320, ack 129, win 502, options [nop,nop,TS val 3494272590 ecr 2826201625], length 240
19:11:34.471176 IP 159.203.57.152.22 > 162.243.190.66.60588: Flags [P.], seq 5390320:5390560, ack 129, win 502, options [nop,nop,TS val 3494272590 ecr 2826201625], length 240
19:11:34.471214 IP 159.203.57.152.22 > 162.243.190.66.60588: Flags [P.], seq 5390560:5390800, ack 129, win 502, options [nop,nop,TS val 3494272590 ecr 2826201625], length 240
19:11:34.471251 IP 162.243.190.66.60588 > 159.203.57.152.22: Flags [.], ack 5390080, win 501, options [nop,nop,TS val 2826201625 ecr 3494272590], length 0
19:11:34.471295 IP 159.203.57.152.22 > 162.243.190.66.60588: Flags [P.], seq 5390800:5391184, ack 129, win 502, options [nop,nop,TS val 3494272590 ecr 2826201625], length 384
19:11:34.471339 IP 159.203.57.152.22 > 162.243.190.66.60588: Flags [P.], seq 5391184:5391424, ack 129, win 502, options [nop,nop,TS val 3494272590 ecr 2826201625], length 240
19:11:34.471399 IP 159.203.57.152.22 > 162.243.190.66.60588: Flags [P.], seq 5391424:5391664, ack 129, win 502, options [nop,nop,TS val 3494272590 ecr 2826201625], length 240
19:11:34.471462 IP 159.203.57.152.22 > 162.243.190.66.60588: Flags [P.], seq 5391664:5391904, ack 129, win 502, options [nop,nop,TS val 3494272590 ecr 2826201625], length 240
19:11:34.471518 IP 159.203.57.152.22 > 162.243.190.66.60588: Flags [P.], seq 5391904:5392144, ack 129, win 502, options [nop,nop,TS val 3494272590 ecr 2826201625], length 240
19:11:34.471567 IP 162.243.190.66.60588 > 159.203.57.152.22: Flags [.], ack 5391664, win 501, options [nop,nop,TS val 2826201626 ecr 3494272590], length 0
19:11:34.471584 IP 159.203.57.152.22 > 162.243.190.66.60588: Flags [P.], seq 5392144:5392384, ack 129, win 502, options [nop,nop,TS val 3494272591 ecr 2826201626], length 240
19:11:34.471646 IP 159.203.57.152.22 > 162.243.190.66.60588: Flags [P.], seq 5392384:5392768, ack 129, win 502, options [nop,nop,TS val 3494272591 ecr 2826201626], length 384
19:11:34.471694 IP 159.203.57.152.22 > 162.243.190.66.60588: Flags [P.], seq 5392768:5393008, ack 129, win 502, options [nop,nop,TS val 3494272591 ecr 2826201626], length 240
19:11:34.471740 IP 159.203.57.152.22 > 162.243.190.66.60588: Flags [P.], seq 5393008:5393248, ack 129, win 502, options [nop,nop,TS val 3494272591 ecr 2826201626], length 240
19:11:34.471787 IP 159.203.57.152.22 > 162.243.190.66.60588: Flags [P.], seq 5393248:5393488, ack 129, win 502, options [nop,nop,TS val 3494272591 ecr 2826201626], length 240
19:11:34.471838 IP 159.203.57.152.22 > 162.243.190.66.60588: Flags [P.], seq 5393488:5393728, ack 129, win 502, options [nop,nop,TS val 3494272591 ecr 2826201626], length 240
19:11:34.471886 IP 159.203.57.152.22 > 162.243.190.66.60588: Flags [P.], seq 5393728:5393968, ack 129, win 502, options [nop,nop,TS val 3494272591 ecr 2826201626], length 240
19:11:34.471935 IP 159.203.57.152.22 > 162.243.190.66.60588: Flags [P.], seq 5393968:5394208, ack 129, win 502, options [nop,nop,TS val 3494272591 ecr 2826201626], length 240
19:11:34.471987 IP 159.203.57.152.22 > 162.243.190.66.60588: Flags [P.], seq 5394208:5394448, ack 129, win 502, options [nop,nop,TS val 3494272591 ecr 2826201626], length 240
19:11:34.472035 IP 159.203.57.152.22 > 162.243.190.66.60588: Flags [P.], seq 5394448:5394688, ack 129, win 502, options [nop,nop,TS val 3494272591 ecr 2826201626], length 240
19:11:34.472085 IP 159.203.57.152.22 > 162.243.190.66.60588: Flags [P.], seq 5394688:5394928, ack 129, win 502, options [nop,nop,TS val 3494272591 ecr 2826201626], length 240
19:11:34.472131 IP 159.203.57.152.22 > 162.243.190.66.60588: Flags [P.], seq 5394928:5395168, ack 129, win 502, options [nop,nop,TS val 3494272591 ecr 2826201626], length 240
19:11:34.472186 IP 159.203.57.152.22 > 162.243.190.66.60588: Flags [P.], seq 5395168:5395408, ack 129, win 502, options [nop,nop,TS val 3494272591 ecr 2826201626], length 240
19:11:34.472241 IP 159.203.57.152.22 > 162.243.190.66.60588: Flags [P.], seq 5395408:5395648, ack 129, win 502, options [nop,nop,TS val 3494272591 ecr 2826201626], length 240
19:11:34.472294 IP 159.203.57.152.22 > 162.243.190.66.60588: Flags [P.], seq 5395648:5395888, ack 129, win 502, options [nop,nop,TS val 3494272591 ecr 2826201626], length 240
19:11:34.472345 IP 159.203.57.152.22 > 162.243.190.66.60588: Flags [P.], seq 5395888:5396128, ack 129, win 502, options [nop,nop,TS val 3494272591 ecr 2826201626], length 240
19:11:34.472413 IP 159.203.57.152.22 > 162.243.190.66.60588: Flags [P.], seq 5396128:5396368, ack 129, win 502, options [nop,nop,TS val 3494272591 ecr 2826201626], length 240
19:11:34.472469 IP 159.203.57.152.22 > 162.243.190.66.60588: Flags [P.], seq 5396368:5396608, ack 129, win 502, options [nop,nop,TS val 3494272591 ecr 2826201626], length 240
19:11:34.472523 IP 159.203.57.152.22 > 162.243.190.66.60588: Flags [P.], seq 5396608:5396848, ack 129, win 502, options [nop,nop,TS val 3494272591 ecr 2826201626], length 240
19:11:34.472576 IP 159.203.57.152.22 > 162.243.190.66.60588: Flags [P.], seq 5396848:5397088, ack 129, win 502, options [nop,nop,TS val 3494272592 ecr 2826201626], length 240
19:11:34.472639 IP 159.203.57.152.22 > 162.243.190.66.60588: Flags [P.], seq 5397088:5397328, ack 129, win 502, options [nop,nop,TS val 3494272592 ecr 2826201626], length 240
19:11:34.472663 IP 162.243.190.66.60588 > 159.203.57.152.22: Flags [.], ack 5393248, win 501, options [nop,nop,TS val 2826201627 ecr 3494272590], length 0
19:11:34.472663 IP 162.243.190.66.60588 > 159.203.57.152.22: Flags [.], ack 5394928, win 501, options [nop,nop,TS val 2826201627 ecr 3494272591], length 0
19:11:34.472663 IP 162.243.190.66.60588 > 159.203.57.152.22: Flags [.], ack 5396608, win 501, options [nop,nop,TS val 2826201627 ecr 3494272591], length 0
19:11:34.472777 IP 159.203.57.152.22 > 162.243.190.66.60588: Flags [P.], seq 5397328:5398032, ack 129, win 502, options [nop,nop,TS val 3494272592 ecr 2826201627], length 704
19:11:34.472832 IP 159.203.57.152.22 > 162.243.190.66.60588: Flags [P.], seq 5398032:5398272, ack 129, win 502, options [nop,nop,TS val 3494272592 ecr 2826201627], length 240
19:11:34.472882 IP 159.203.57.152.22 > 162.243.190.66.60588: Flags [P.], seq 5398272:5398512, ack 129, win 502, options [nop,nop,TS val 3494272592 ecr 2826201627], length 240
19:11:34.472946 IP 159.203.57.152.22 > 162.243.190.66.60588: Flags [P.], seq 5398512:5398752, ack 129, win 502, options [nop,nop,TS val 3494272592 ecr 2826201627], length 240
19:11:34.473001 IP 159.203.57.152.22 > 162.243.190.66.60588: Flags [P.], seq 5398752:5398992, ack 129, win 502, options [nop,nop,TS val 3494272592 ecr 2826201627], length 240
19:11:34.473061 IP 159.203.57.152.22 > 162.243.190.66.60588: Flags [P.], seq 5398992:5399232, ack 129, win 502, options [nop,nop,TS val 3494272592 ecr 2826201627], length 240
19:11:34.473075 IP 162.243.190.66.60588 > 159.203.57.152.22: Flags [.], ack 5398272, win 501, options [nop,nop,TS val 2826201627 ecr 3494272591], length 0
19:11:34.473136 IP 159.203.57.152.22 > 162.243.190.66.60588: Flags [P.], seq 5399232:5399616, ack 129, win 502, options [nop,nop,TS val 3494272592 ecr 2826201627], length 384
19:11:34.473184 IP 159.203.57.152.22 > 162.243.190.66.60588: Flags [P.], seq 5399616:5399856, ack 129, win 502, options [nop,nop,TS val 3494272592 ecr 2826201627], length 240
19:11:34.473223 IP 159.203.57.152.22 > 162.243.190.66.60588: Flags [P.], seq 5399856:5400096, ack 129, win 502, options [nop,nop,TS val 3494272592 ecr 2826201627], length 240
19:11:34.473262 IP 159.203.57.152.22 > 162.243.190.66.60588: Flags [P.], seq 5400096:5400336, ack 129, win 502, options [nop,nop,TS val 3494272592 ecr 2826201627], length 240
19:11:34.473304 IP 159.203.57.152.22 > 162.243.190.66.60588: Flags [P.], seq 5400336:5400576, ack 129, win 502, options [nop,nop,TS val 3494272592 ecr 2826201627], length 240
19:11:34.473344 IP 159.203.57.152.22 > 162.243.190.66.60588: Flags [P.], seq 5400576:5400816, ack 129, win 502, options [nop,nop,TS val 3494272592 ecr 2826201627], length 240
19:11:34.473384 IP 159.203.57.152.22 > 162.243.190.66.60588: Flags [P.], seq 5400816:5401056, ack 129, win 502, options [nop,nop,TS val 3494272592 ecr 2826201627], length 240
19:11:34.473425 IP 159.203.57.152.22 > 162.243.190.66.60588: Flags [P.], seq 5401056:5401296, ack 129, win 502, options [nop,nop,TS val 3494272592 ecr 2826201627], length 240
19:11:34.473464 IP 159.203.57.152.22 > 162.243.190.66.60588: Flags [P.], seq 5401296:5401536, ack 129, win 502, options [nop,nop,TS val 3494272592 ecr 2826201627], length 240
19:11:34.473502 IP 159.203.57.152.22 > 162.243.190.66.60588: Flags [P.], seq 5401536:5401776, ack 129, win 502, options [nop,nop,TS val 3494272592 ecr 2826201627], length 240
19:11:34.473544 IP 159.203.57.152.22 > 162.243.190.66.60588: Flags [P.], seq 5401776:5402016, ack 129, win 502, options [nop,nop,TS val 3494272592 ecr 2826201627], length 240
19:11:34.473582 IP 159.203.57.152.22 > 162.243.190.66.60588: Flags [P.], seq 5402016:5402256, ack 129, win 502, options [nop,nop,TS val 3494272593 ecr 2826201627], length 240
19:11:34.473623 IP 159.203.57.152.22 > 162.243.190.66.60588: Flags [P.], seq 5402256:5402496, ack 129, win 502, options [nop,nop,TS val 3494272593 ecr 2826201627], length 240
19:11:34.473661 IP 159.203.57.152.22 > 162.243.190.66.60588: Flags [P.], seq 5402496:5402736, ack 129, win 502, options [nop,nop,TS val 3494272593 ecr 2826201627], length 240
19:11:34.473721 IP 159.203.57.152.22 > 162.243.190.66.60588: Flags [P.], seq 5402736:5402976, ack 129, win 502, options [nop,nop,TS val 3494272593 ecr 2826201627], length 240
19:11:34.473764 IP 159.203.57.152.22 > 162.243.190.66.60588: Flags [P.], seq 5402976:5403216, ack 129, win 502, options [nop,nop,TS val 3494272593 ecr 2826201627], length 240
19:11:34.473807 IP 159.203.57.152.22 > 162.243.190.66.60588: Flags [P.], seq 5403216:5403456, ack 129, win 502, options [nop,nop,TS val 3494272593 ecr 2826201627], length 240
19:11:34.473865 IP 159.203.57.152.22 > 162.243.190.66.60588: Flags [P.], seq 5403456:5403696, ack 129, win 502, options [nop,nop,TS val 3494272593 ecr 2826201627], length 240
19:11:34.473906 IP 159.203.57.152.22 > 162.243.190.66.60588: Flags [P.], seq 5403696:5403936, ack 129, win 502, options [nop,nop,TS val 3494272593 ecr 2826201627], length 240
19:11:34.473930 IP 162.243.190.66.60588 > 159.203.57.152.22: Flags [.], ack 5399856, win 501, options [nop,nop,TS val 2826201628 ecr 3494272592], length 0
19:11:34.473954 IP 162.243.190.66.60588 > 159.203.57.152.22: Flags [.], ack 5402016, win 501, options [nop,nop,TS val 2826201628 ecr 3494272592], length 0
19:11:34.473988 IP 159.203.57.152.22 > 162.243.190.66.60588: Flags [P.], seq 5403936:5404480, ack 129, win 502, options [nop,nop,TS val 3494272593 ecr 2826201628], length 544
19:11:34.474029 IP 159.203.57.152.22 > 162.243.190.66.60588: Flags [P.], seq 5404480:5404720, ack 129, win 502, options [nop,nop,TS val 3494272593 ecr 2826201628], length 240
19:11:34.474069 IP 159.203.57.152.22 > 162.243.190.66.60588: Flags [P.], seq 5404720:5404960, ack 129, win 502, options [nop,nop,TS val 3494272593 ecr 2826201628], length 240
19:11:34.474109 IP 159.203.57.152.22 > 162.243.190.66.60588: Flags [P.], seq 5404960:5405200, ack 129, win 502, options [nop,nop,TS val 3494272593 ecr 2826201628], length 240
19:11:34.474150 IP 159.203.57.152.22 > 162.243.190.66.60588: Flags [P.], seq 5405200:5405440, ack 129, win 502, options [nop,nop,TS val 3494272593 ecr 2826201628], length 240
19:11:34.474213 IP 162.243.190.66.60588 > 159.203.57.152.22: Flags [.], ack 5403696, win 501, options [nop,nop,TS val 2826201628 ecr 3494272593], length 0
19:11:34.474222 IP 159.203.57.152.22 > 162.243.190.66.60588: Flags [P.], seq 5405440:5405680, ack 129, win 502, options [nop,nop,TS val 3494272593 ecr 2826201628], length 240
19:11:34.474300 IP 159.203.57.152.22 > 162.243.190.66.60588: Flags [P.], seq 5405680:5406064, ack 129, win 502, options [nop,nop,TS val 3494272593 ecr 2826201628], length 384
19:11:34.474346 IP 159.203.57.152.22 > 162.243.190.66.60588: Flags [P.], seq 5406064:5406304, ack 129, win 502, options [nop,nop,TS val 3494272593 ecr 2826201628], length 240
19:11:34.474375 IP 162.243.190.66.60588 > 159.203.57.152.22: Flags [.], ack 5405200, win 501, options [nop,nop,TS val 2826201629 ecr 3494272593], length 0
19:11:34.474409 IP 159.203.57.152.22 > 162.243.190.66.60588: Flags [P.], seq 5406304:5406688, ack 129, win 502, options [nop,nop,TS val 3494272593 ecr 2826201629], length 384
19:11:34.474449 IP 159.203.57.152.22 > 162.243.190.66.60588: Flags [P.], seq 5406688:5406928, ack 129, win 502, options [nop,nop,TS val 3494272593 ecr 2826201629], length 240
19:11:34.474488 IP 159.203.57.152.22 > 162.243.190.66.60588: Flags [P.], seq 5406928:5407168, ack 129, win 502, options [nop,nop,TS val 3494272593 ecr 2826201629], length 240
19:11:34.474526 IP 159.203.57.152.22 > 162.243.190.66.60588: Flags [P.], seq 5407168:5407408, ack 129, win 502, options [nop,nop,TS val 3494272593 ecr 2826201629], length 240
19:11:34.474563 IP 159.203.57.152.22 > 162.243.190.66.60588: Flags [P.], seq 5407408:5407648, ack 129, win 502, options [nop,nop,TS val 3494272593 ecr 2826201629], length 240
19:11:34.474609 IP 159.203.57.152.22 > 162.243.190.66.60588: Flags [P.], seq 5407648:5407888, ack 129, win 502, options [nop,nop,TS val 3494272594 ecr 2826201629], length 240
19:11:34.474648 IP 159.203.57.152.22 > 162.243.190.66.60588: Flags [P.], seq 5407888:5408128, ack 129, win 502, options [nop,nop,TS val 3494272594 ecr 2826201629], length 240
19:11:34.474705 IP 159.203.57.152.22 > 162.243.190.66.60588: Flags [P.], seq 5408128:5408368, ack 129, win 502, options [nop,nop,TS val 3494272594 ecr 2826201629], length 240
19:11:34.474772 IP 159.203.57.152.22 > 162.243.190.66.60588: Flags [P.], seq 5408368:5408608, ack 129, win 502, options [nop,nop,TS val 3494272594 ecr 2826201629], length 240
19:11:34.474833 IP 159.203.57.152.22 > 162.243.190.66.60588: Flags [P.], seq 5408608:5408848, ack 129, win 502, options [nop,nop,TS val 3494272594 ecr 2826201629], length 240
19:11:34.474897 IP 159.203.57.152.22 > 162.243.190.66.60588: Flags [P.], seq 5408848:5409088, ack 129, win 502, options [nop,nop,TS val 3494272594 ecr 2826201629], length 240
19:11:34.474964 IP 159.203.57.152.22 > 162.243.190.66.60588: Flags [P.], seq 5409088:5409328, ack 129, win 502, options [nop,nop,TS val 3494272594 ecr 2826201629], length 240
19:11:34.475010 IP 159.203.57.152.22 > 162.243.190.66.60588: Flags [P.], seq 5409328:5409568, ack 129, win 502, options [nop,nop,TS val 3494272594 ecr 2826201629], length 240
19:11:34.475041 IP 162.243.190.66.60588 > 159.203.57.152.22: Flags [.], ack 5406688, win 501, options [nop,nop,TS val 2826201629 ecr 3494272593], length 0
19:11:34.475059 IP 162.243.190.66.60588 > 159.203.57.152.22: Flags [.], ack 5408848, win 501, options [nop,nop,TS val 2826201629 ecr 3494272593], length 0
19:11:34.475116 IP 159.203.57.152.22 > 162.243.190.66.60588: Flags [P.], seq 5409568:5410112, ack 129, win 502, options [nop,nop,TS val 3494272594 ecr 2826201629], length 544
19:11:34.475158 IP 159.203.57.152.22 > 162.243.190.66.60588: Flags [P.], seq 5410112:5410352, ack 129, win 502, options [nop,nop,TS val 3494272594 ecr 2826201629], length 240
19:11:34.475210 IP 159.203.57.152.22 > 162.243.190.66.60588: Flags [P.], seq 5410352:5410592, ack 129, win 502, options [nop,nop,TS val 3494272594 ecr 2826201629], length 240
19:11:34.475269 IP 159.203.57.152.22 > 162.243.190.66.60588: Flags [P.], seq 5410592:5410832, ack 129, win 502, options [nop,nop,TS val 3494272594 ecr 2826201629], length 240
19:11:34.475309 IP 159.203.57.152.22 > 162.243.190.66.60588: Flags [P.], seq 5410832:5410896, ack 129, win 502, options [nop,nop,TS val 3494272594 ecr 2826201629], length 64
19:11:34.475415 IP 162.243.190.66.60588 > 159.203.57.152.22: Flags [.], ack 5410352, win 501, options [nop,nop,TS val 2826201630 ecr 3494272594], length 0
19:11:34.491155 IP 159.203.57.152.22 > 162.243.190.66.60588: Flags [P.], seq 5410832:5410896, ack 129, win 502, options [nop,nop,TS val 3494272610 ecr 2826201630], length 64
19:11:34.491511 IP 162.243.190.66.60588 > 159.203.57.152.22: Flags [.], ack 5410896, win 501, options [nop,nop,TS val 2826201646 ecr 3494272594,nop,nop,sack 1 {5410832:5410896}], length 0
19:11:36.821623 IP 162.243.190.66.60588 > 159.203.57.152.22: Flags [P.], seq 129:161, ack 5410896, win 501, options [nop,nop,TS val 2826203976 ecr 3494272594], length 32
19:11:36.821623 IP 162.243.190.66.60588 > 159.203.57.152.22: Flags [P.], seq 161:193, ack 5410896, win 501, options [nop,nop,TS val 2826203976 ecr 3494272594], length 32
^C
24331 packets captured
24433 packets received by filter
99 packets dropped by kernel