,nop,TS val 3493888791 ecr 2825817824], length 256
19:05:10.671692 IP lamp-ubuntu-s-1vcpu-1gb-tor1-01.ssh > 162.243.190.66.60588: Flags [P.], seq 2528512:2528768, ack 1, win 502, options [nop,nop,TS val 3493888791 ecr 2825817824], length 256
19:05:10.671732 IP lamp-ubuntu-s-1vcpu-1gb-tor1-01.ssh > 162.243.190.66.60588: Flags [P.], seq 2528768:2529024, ack 1, win 502, options [nop,nop,TS val 3493888791 ecr 2825817824], length 256
19:05:10.671771 IP lamp-ubuntu-s-1vcpu-1gb-tor1-01.ssh > 162.243.190.66.60588: Flags [P.], seq 2529024:2529280, ack 1, win 502, options [nop,nop,TS val 3493888791 ecr 2825817824], length 256
19:05:10.671832 IP lamp-ubuntu-s-1vcpu-1gb-tor1-01.ssh > 162.243.190.66.60588: Flags [P.], seq 2529280:2529536, ack 1, win 502, options [nop,nop,TS val 3493888791 ecr 2825817824], length 256
19:05:10.671893 IP lamp-ubuntu-s-1vcpu-1gb-tor1-01.ssh > 162.243.190.66.60588: Flags [P.], seq 2529536:2529792, ack 1, win 502, options [nop,nop,TS val 3493888791 ecr 2825817824], length 256
19:05:10.671935 IP lamp-ubuntu-s-1vcpu-1gb-tor1-01.ssh > 162.243.190.66.60588: Flags [P.], seq 2529792:2530048, ack 1, win 502, options [nop,nop,TS val 3493888791 ecr 2825817824], length 256
19:05:10.671978 IP lamp-ubuntu-s-1vcpu-1gb-tor1-01.ssh > 162.243.190.66.60588: Flags [P.], seq 2530048:2530304, ack 1, win 502, options [nop,nop,TS val 3493888791 ecr 2825817824], length 256
19:05:10.672034 IP lamp-ubuntu-s-1vcpu-1gb-tor1-01.ssh > 162.243.190.66.60588: Flags [P.], seq 2530304:2530560, ack 1, win 502, options [nop,nop,TS val 3493888791 ecr 2825817824], length 256
19:05:10.672075 IP lamp-ubuntu-s-1vcpu-1gb-tor1-01.ssh > 162.243.190.66.60588: Flags [P.], seq 2530560:2530816, ack 1, win 502, options [nop,nop,TS val 3493888791 ecr 2825817824], length 256
19:05:10.672130 IP lamp-ubuntu-s-1vcpu-1gb-tor1-01.ssh > 162.243.190.66.60588: Flags [P.], seq 2530816:2531072, ack 1, win 502, options [nop,nop,TS val 3493888791 ecr 2825817824], length 256
19:05:10.672194 IP lamp-ubuntu-s-1vcpu-1gb-tor1-01.ssh > 162.243.190.66.60588: Flags [P.], seq 2531072:2531328, ack 1, win 502, options [nop,nop,TS val 3493888791 ecr 2825817824], length 256
19:05:10.672246 IP lamp-ubuntu-s-1vcpu-1gb-tor1-01.ssh > 162.243.190.66.60588: Flags [P.], seq 2531328:2531584, ack 1, win 502, options [nop,nop,TS val 3493888791 ecr 2825817824], length 256
19:05:10.672290 IP lamp-ubuntu-s-1vcpu-1gb-tor1-01.ssh > 162.243.190.66.60588: Flags [P.], seq 2531584:2531840, ack 1, win 502, options [nop,nop,TS val 3493888791 ecr 2825817824], length 256
19:05:10.672330 IP lamp-ubuntu-s-1vcpu-1gb-tor1-01.ssh > 162.243.190.66.60588: Flags [P.], seq 2531840:2532096, ack 1, win 502, options [nop,nop,TS val 3493888791 ecr 2825817824], length 256
19:05:10.672370 IP lamp-ubuntu-s-1vcpu-1gb-tor1-01.ssh > 162.243.190.66.60588: Flags [P.], seq 2532096:2532352, ack 1, win 502, options [nop,nop,TS val 3493888791 ecr 2825817824], length 256
19:05:10.672409 IP lamp-ubuntu-s-1vcpu-1gb-tor1-01.ssh > 162.243.190.66.60588: Flags [P.], seq 2532352:2532608, ack 1, win 502, options [nop,nop,TS val 3493888791 ecr 2825817824], length 256
19:05:10.672449 IP lamp-ubuntu-s-1vcpu-1gb-tor1-01.ssh > 162.243.190.66.60588: Flags [P.], seq 2532608:2532864, ack 1, win 502, options [nop,nop,TS val 3493888791 ecr 2825817824], length 256
19:05:10.672487 IP lamp-ubuntu-s-1vcpu-1gb-tor1-01.ssh > 162.243.190.66.60588: Flags [P.], seq 2532864:2533120, ack 1, win 502, options [nop,nop,TS val 3493888791 ecr 2825817824], length 256
19:05:10.672526 IP lamp-ubuntu-s-1vcpu-1gb-tor1-01.ssh > 162.243.190.66.60588: Flags [P.], seq 2533120:2533376, ack 1, win 502, options [nop,nop,TS val 3493888791 ecr 2825817824], length 256
19:05:10.672567 IP lamp-ubuntu-s-1vcpu-1gb-tor1-01.ssh > 162.243.190.66.60588: Flags [P.], seq 2533376:2533632, ack 1, win 502, options [nop,nop,TS val 3493888791 ecr 2825817824], length 256
19:05:10.672607 IP lamp-ubuntu-s-1vcpu-1gb-tor1-01.ssh > 162.243.190.66.60588: Flags [P.], seq 2533632:2533888, ack 1, win 502, options [nop,nop,TS val 3493888792 ecr 2825817824], length 256
19:05:10.672650 IP lamp-ubuntu-s-1vcpu-1gb-tor1-01.ssh > 162.243.190.66.60588: Flags [P.], seq 2533888:2534144, ack 1, win 502, options [nop,nop,TS val 3493888792 ecr 2825817824], length 256
19:05:10.672689 IP lamp-ubuntu-s-1vcpu-1gb-tor1-01.ssh > 162.243.190.66.60588: Flags [P.], seq 2534144:2534400, ack 1, win 502, options [nop,nop,TS val 3493888792 ecr 2825817824], length 256
19:05:10.672730 IP lamp-ubuntu-s-1vcpu-1gb-tor1-01.ssh > 162.243.190.66.60588: Flags [P.], seq 2534400:2534656, ack 1, win 502, options [nop,nop,TS val 3493888792 ecr 2825817824], length 256
19:05:10.672769 IP lamp-ubuntu-s-1vcpu-1gb-tor1-01.ssh > 162.243.190.66.60588: Flags [P.], seq 2534656:2534912, ack 1, win 502, options [nop,nop,TS val 3493888792 ecr 2825817824], length 256
19:05:10.672807 IP lamp-ubuntu-s-1vcpu-1gb-tor1-01.ssh > 162.243.190.66.60588: Flags [P.], seq 2534912:2535168, ack 1, win 502, options [nop,nop,TS val 3493888792 ecr 2825817824], length 256
19:05:10.672848 IP lamp-ubuntu-s-1vcpu-1gb-tor1-01.ssh > 162.243.190.66.60588: Flags [P.], seq 2535168:2535424, ack 1, win 502, options [nop,nop,TS val 3493888792 ecr 2825817824], length 256
19:05:10.672887 IP lamp-ubuntu-s-1vcpu-1gb-tor1-01.ssh > 162.243.190.66.60588: Flags [P.], seq 2535424:2535680, ack 1, win 502, options [nop,nop,TS val 3493888792 ecr 2825817824], length 256
19:05:10.672929 IP lamp-ubuntu-s-1vcpu-1gb-tor1-01.ssh > 162.243.190.66.60588: Flags [P.], seq 2535680:2535936, ack 1, win 502, options [nop,nop,TS val 3493888792 ecr 2825817824], length 256
19:05:10.672959 IP 162.243.190.66.60588 > lamp-ubuntu-s-1vcpu-1gb-tor1-01.ssh: Flags [.], ack 2530304, win 103, options [nop,nop,TS val 2825817827 ecr 3493888789], length 0
19:05:10.673015 IP lamp-ubuntu-s-1vcpu-1gb-tor1-01.ssh > 162.243.190.66.60588: Flags [P.], seq 2535936:2536352, ack 1, win 502, options [nop,nop,TS val 3493888792 ecr 2825817827], length 416
19:05:10.673081 IP lamp-ubuntu-s-1vcpu-1gb-tor1-01.ssh > 162.243.190.66.60588: Flags [P.], seq 2536352:2536608, ack 1, win 502, options [nop,nop,TS val 3493888792 ecr 2825817827], length 256
19:05:10.673145 IP lamp-ubuntu-s-1vcpu-1gb-tor1-01.ssh > 162.243.190.66.60588: Flags [P.], seq 2536608:2536864, ack 1, win 502, options [nop,nop,TS val 3493888792 ecr 2825817827], length 256
19:05:10.673189 IP lamp-ubuntu-s-1vcpu-1gb-tor1-01.ssh > 162.243.190.66.60588: Flags [P.], seq 2536864:2537120, ack 1, win 502, options [nop,nop,TS val 3493888792 ecr 2825817827], length 256
19:05:10.673231 IP lamp-ubuntu-s-1vcpu-1gb-tor1-01.ssh > 162.243.190.66.60588: Flags [P.], seq 2537120:2537376, ack 1, win 502, options [nop,nop,TS val 3493888792 ecr 2825817827], length 256
19:05:10.673251 IP 162.243.190.66.60588 > lamp-ubuntu-s-1vcpu-1gb-tor1-01.ssh: Flags [.], ack 2536352, win 56, options [nop,nop,TS val 2825817827 ecr 3493888791], length 0
19:05:10.673299 IP lamp-ubuntu-s-1vcpu-1gb-tor1-01.ssh > 162.243.190.66.60588: Flags [P.], seq 2537376:2537792, ack 1, win 502, options [nop,nop,TS val 3493888792 ecr 2825817827], length 416
19:05:10.673341 IP lamp-ubuntu-s-1vcpu-1gb-tor1-01.ssh > 162.243.190.66.60588: Flags [P.], seq 2537792:2538048, ack 1, win 502, options [nop,nop,TS val 3493888792 ecr 2825817827], length 256
19:05:10.673381 IP lamp-ubuntu-s-1vcpu-1gb-tor1-01.ssh > 162.243.190.66.60588: Flags [P.], seq 2538048:2538304, ack 1, win 502, options [nop,nop,TS val 3493888792 ecr 2825817827], length 256
19:05:10.673419 IP lamp-ubuntu-s-1vcpu-1gb-tor1-01.ssh > 162.243.190.66.60588: Flags [P.], seq 2538304:2538560, ack 1, win 502, options [nop,nop,TS val 3493888792 ecr 2825817827], length 256
19:05:10.673458 IP lamp-ubuntu-s-1vcpu-1gb-tor1-01.ssh > 162.243.190.66.60588: Flags [P.], seq 2538560:2538816, ack 1, win 502, options [nop,nop,TS val 3493888792 ecr 2825817827], length 256
19:05:10.673497 IP lamp-ubuntu-s-1vcpu-1gb-tor1-01.ssh > 162.243.190.66.60588: Flags [P.], seq 2538816:2539072, ack 1, win 502, options [nop,nop,TS val 3493888792 ecr 2825817827], length 256
19:05:10.673536 IP lamp-ubuntu-s-1vcpu-1gb-tor1-01.ssh > 162.243.190.66.60588: Flags [P.], seq 2539072:2539328, ack 1, win 502, options [nop,nop,TS val 3493888792 ecr 2825817827], length 256
19:05:10.673575 IP lamp-ubuntu-s-1vcpu-1gb-tor1-01.ssh > 162.243.190.66.60588: Flags [P.], seq 2539328:2539584, ack 1, win 502, options [nop,nop,TS val 3493888793 ecr 2825817827], length 256
19:05:10.673613 IP lamp-ubuntu-s-1vcpu-1gb-tor1-01.ssh > 162.243.190.66.60588: Flags [P.], seq 2539584:2539840, ack 1, win 502, options [nop,nop,TS val 3493888793 ecr 2825817827], length 256
19:05:10.673654 IP lamp-ubuntu-s-1vcpu-1gb-tor1-01.ssh > 162.243.190.66.60588: Flags [P.], seq 2539840:2540096, ack 1, win 502, options [nop,nop,TS val 3493888793 ecr 2825817827], length 256
19:05:10.673708 IP lamp-ubuntu-s-1vcpu-1gb-tor1-01.ssh > 162.243.190.66.60588: Flags [P.], seq 2540096:2540352, ack 1, win 502, options [nop,nop,TS val 3493888793 ecr 2825817827], length 256
19:05:10.673753 IP lamp-ubuntu-s-1vcpu-1gb-tor1-01.ssh > 162.243.190.66.60588: Flags [P.], seq 2540352:2540608, ack 1, win 502, options [nop,nop,TS val 3493888793 ecr 2825817827], length 256
19:05:10.673794 IP lamp-ubuntu-s-1vcpu-1gb-tor1-01.ssh > 162.243.190.66.60588: Flags [P.], seq 2540608:2540864, ack 1, win 502, options [nop,nop,TS val 3493888793 ecr 2825817827], length 256
19:05:10.673833 IP lamp-ubuntu-s-1vcpu-1gb-tor1-01.ssh > 162.243.190.66.60588: Flags [P.], seq 2540864:2541120, ack 1, win 502, options [nop,nop,TS val 3493888793 ecr 2825817827], length 256
19:05:10.673872 IP lamp-ubuntu-s-1vcpu-1gb-tor1-01.ssh > 162.243.190.66.60588: Flags [P.], seq 2541120:2541376, ack 1, win 502, options [nop,nop,TS val 3493888793 ecr 2825817827], length 256
19:05:10.673912 IP lamp-ubuntu-s-1vcpu-1gb-tor1-01.ssh > 162.243.190.66.60588: Flags [P.], seq 2541376:2541632, ack 1, win 502, options [nop,nop,TS val 3493888793 ecr 2825817827], length 256
19:05:10.673953 IP lamp-ubuntu-s-1vcpu-1gb-tor1-01.ssh > 162.243.190.66.60588: Flags [P.], seq 2541632:2541888, ack 1, win 502, options [nop,nop,TS val 3493888793 ecr 2825817827], length 256
19:05:10.673991 IP lamp-ubuntu-s-1vcpu-1gb-tor1-01.ssh > 162.243.190.66.60588: Flags [P.], seq 2541888:2542144, ack 1, win 502, options [nop,nop,TS val 3493888793 ecr 2825817827], length 256
19:05:10.674032 IP lamp-ubuntu-s-1vcpu-1gb-tor1-01.ssh > 162.243.190.66.60588: Flags [P.], seq 2542144:2542400, ack 1, win 502, options [nop,nop,TS val 3493888793 ecr 2825817827], length 256
19:05:10.674070 IP lamp-ubuntu-s-1vcpu-1gb-tor1-01.ssh > 162.243.190.66.60588: Flags [P.], seq 2542400:2542656, ack 1, win 502, options [nop,nop,TS val 3493888793 ecr 2825817827], length 256
19:05:10.674111 IP lamp-ubuntu-s-1vcpu-1gb-tor1-01.ssh > 162.243.190.66.60588: Flags [P.], seq 2542656:2542912, ack 1, win 502, options [nop,nop,TS val 3493888793 ecr 2825817827], length 256
19:05:10.674149 IP lamp-ubuntu-s-1vcpu-1gb-tor1-01.ssh > 162.243.190.66.60588: Flags [P.], seq 2542912:2543168, ack 1, win 502, options [nop,nop,TS val 3493888793 ecr 2825817827], length 256
19:05:10.674192 IP lamp-ubuntu-s-1vcpu-1gb-tor1-01.ssh > 162.243.190.66.60588: Flags [P.], seq 2543168:2543424, ack 1, win 502, options [nop,nop,TS val 3493888793 ecr 2825817827], length 256
19:05:10.674634 IP 162.243.190.66.60588 > lamp-ubuntu-s-1vcpu-1gb-tor1-01.ssh: Flags [.], ack 2538048, win 43, options [nop,nop,TS val 2825817829 ecr 3493888792], length 0
19:05:10.674634 IP 162.243.190.66.60588 > lamp-ubuntu-s-1vcpu-1gb-tor1-01.ssh: Flags [.], ack 2543424, win 1, options [nop,nop,TS val 2825817829 ecr 3493888792], length 0
19:05:10.727056 IP 162.243.190.66.60588 > lamp-ubuntu-s-1vcpu-1gb-tor1-01.ssh: Flags [.], ack 2543424, win 267, options [nop,nop,TS val 2825817881 ecr 3493888792], length 0
19:05:10.727112 IP lamp-ubuntu-s-1vcpu-1gb-tor1-01.ssh > 162.243.190.66.60588: Flags [P.], seq 2543424:2544080, ack 1, win 502, options [nop,nop,TS val 3493888846 ecr 2825817881], length 656
19:05:10.727334 IP lamp-ubuntu-s-1vcpu-1gb-tor1-01.ssh > 162.243.190.66.60588: Flags [P.], seq 2544080:2544496, ack 1, win 502, options [nop,nop,TS val 3493888846 ecr 2825817881], length 416
19:05:10.727424 IP lamp-ubuntu-s-1vcpu-1gb-tor1-01.ssh > 162.243.190.66.60588: Flags [P.], seq 2544496:2544752, ack 1, win 502, options [nop,nop,TS val 3493888846 ecr 2825817881], length 256
19:05:10.727490 IP lamp-ubuntu-s-1vcpu-1gb-tor1-01.ssh > 162.243.190.66.60588: Flags [P.], seq 2544752:2545008, ack 1, win 502, options [nop,nop,TS val 3493888846 ecr 2825817881], length 256
19:05:10.727538 IP lamp-ubuntu-s-1vcpu-1gb-tor1-01.ssh > 162.243.190.66.60588: Flags [P.], seq 2545008:2545264, ack 1, win 502, options [nop,nop,TS val 3493888846 ecr 2825817881], length 256
19:05:10.727582 IP lamp-ubuntu-s-1vcpu-1gb-tor1-01.ssh > 162.243.190.66.60588: Flags [P.], seq 2545264:2545520, ack 1, win 502, options [nop,nop,TS val 3493888847 ecr 2825817881], length 256
19:05:10.727625 IP lamp-ubuntu-s-1vcpu-1gb-tor1-01.ssh > 162.243.190.66.60588: Flags [P.], seq 2545520:2545776, ack 1, win 502, options [nop,nop,TS val 3493888847 ecr 2825817881], length 256
19:05:10.727670 IP lamp-ubuntu-s-1vcpu-1gb-tor1-01.ssh > 162.243.190.66.60588: Flags [P.], seq 2545776:2546032, ack 1, win 502, options [nop,nop,TS val 3493888847 ecr 2825817881], length 256
19:05:10.727710 IP lamp-ubuntu-s-1vcpu-1gb-tor1-01.ssh > 162.243.190.66.60588: Flags [P.], seq 2546032:2546288, ack 1, win 502, options [nop,nop,TS val 3493888847 ecr 2825817881], length 256
19:05:10.727752 IP lamp-ubuntu-s-1vcpu-1gb-tor1-01.ssh > 162.243.190.66.60588: Flags [P.], seq 2546288:2546544, ack 1, win 502, options [nop,nop,TS val 3493888847 ecr 2825817881], length 256
19:05:10.727792 IP lamp-ubuntu-s-1vcpu-1gb-tor1-01.ssh > 162.243.190.66.60588: Flags [P.], seq 2546544:2546800, ack 1, win 502, options [nop,nop,TS val 3493888847 ecr 2825817881], length 256
19:05:10.727832 IP lamp-ubuntu-s-1vcpu-1gb-tor1-01.ssh > 162.243.190.66.60588: Flags [P.], seq 2546800:2547056, ack 1, win 502, options [nop,nop,TS val 3493888847 ecr 2825817881], length 256
19:05:10.727873 IP lamp-ubuntu-s-1vcpu-1gb-tor1-01.ssh > 162.243.190.66.60588: Flags [P.], seq 2547056:2547312, ack 1, win 502, options [nop,nop,TS val 3493888847 ecr 2825817881], length 256
19:05:10.727915 IP lamp-ubuntu-s-1vcpu-1gb-tor1-01.ssh > 162.243.190.66.60588: Flags [P.], seq 2547312:2547568, ack 1, win 502, options [nop,nop,TS val 3493888847 ecr 2825817881], length 256
19:05:10.727975 IP lamp-ubuntu-s-1vcpu-1gb-tor1-01.ssh > 162.243.190.66.60588: Flags [P.], seq 2547568:2547824, ack 1, win 502, options [nop,nop,TS val 3493888847 ecr 2825817881], length 256
19:05:10.728021 IP lamp-ubuntu-s-1vcpu-1gb-tor1-01.ssh > 162.243.190.66.60588: Flags [P.], seq 2547824:2548080, ack 1, win 502, options [nop,nop,TS val 3493888847 ecr 2825817881], length 256
19:05:10.728065 IP lamp-ubuntu-s-1vcpu-1gb-tor1-01.ssh > 162.243.190.66.60588: Flags [P.], seq 2548080:2548336, ack 1, win 502, options [nop,nop,TS val 3493888847 ecr 2825817881], length 256
19:05:10.728105 IP lamp-ubuntu-s-1vcpu-1gb-tor1-01.ssh > 162.243.190.66.60588: Flags [P.], seq 2548336:2548592, ack 1, win 502, options [nop,nop,TS val 3493888847 ecr 2825817881], length 256
19:05:10.728145 IP lamp-ubuntu-s-1vcpu-1gb-tor1-01.ssh > 162.243.190.66.60588: Flags [P.], seq 2548592:2548848, ack 1, win 502, options [nop,nop,TS val 3493888847 ecr 2825817881], length 256
19:05:10.728186 IP lamp-ubuntu-s-1vcpu-1gb-tor1-01.ssh > 162.243.190.66.60588: Flags [P.], seq 2548848:2549104, ack 1, win 502, options [nop,nop,TS val 3493888847 ecr 2825817881], length 256
19:05:10.728225 IP lamp-ubuntu-s-1vcpu-1gb-tor1-01.ssh > 162.243.190.66.60588: Flags [P.], seq 2549104:2549360, ack 1, win 502, options [nop,nop,TS val 3493888847 ecr 2825817881], length 256
19:05:10.728268 IP lamp-ubuntu-s-1vcpu-1gb-tor1-01.ssh > 162.243.190.66.60588: Flags [P.], seq 2549360:2549616, ack 1, win 502, options [nop,nop,TS val 3493888847 ecr 2825817881], length 256
19:05:10.728307 IP lamp-ubuntu-s-1vcpu-1gb-tor1-01.ssh > 162.243.190.66.60588: Flags [P.], seq 2549616:2549872, ack 1, win 502, options [nop,nop,TS val 3493888847 ecr 2825817881], length 256
19:05:10.728347 IP lamp-ubuntu-s-1vcpu-1gb-tor1-01.ssh > 162.243.190.66.60588: Flags [P.], seq 2549872:2550128, ack 1, win 502, options [nop,nop,TS val 3493888847 ecr 2825817881], length 256
19:05:10.728397 IP lamp-ubuntu-s-1vcpu-1gb-tor1-01.ssh > 162.243.190.66.60588: Flags [P.], seq 2550128:2550384, ack 1, win 502, options [nop,nop,TS val 3493888847 ecr 2825817881], length 256
19:05:10.728459 IP lamp-ubuntu-s-1vcpu-1gb-tor1-01.ssh > 162.243.190.66.60588: Flags [P.], seq 2550384:2550640, ack 1, win 502, options [nop,nop,TS val 3493888847 ecr 2825817881], length 256
19:05:10.728517 IP lamp-ubuntu-s-1vcpu-1gb-tor1-01.ssh > 162.243.190.66.60588: Flags [P.], seq 2550640:2550896, ack 1, win 502, options [nop,nop,TS val 3493888847 ecr 2825817881], length 256
19:05:10.728575 IP lamp-ubuntu-s-1vcpu-1gb-tor1-01.ssh > 162.243.190.66.60588: Flags [P.], seq 2550896:2551152, ack 1, win 502, options [nop,nop,TS val 3493888848 ecr 2825817881], length 256
19:05:10.728617 IP lamp-ubuntu-s-1vcpu-1gb-tor1-01.ssh > 162.243.190.66.60588: Flags [P.], seq 2551152:2551408, ack 1, win 502, options [nop,nop,TS val 3493888848 ecr 2825817881], length 256
19:05:10.728672 IP lamp-ubuntu-s-1vcpu-1gb-tor1-01.ssh > 162.243.190.66.60588: Flags [P.], seq 2551408:2551664, ack 1, win 502, options [nop,nop,TS val 3493888848 ecr 2825817881], length 256
19:05:10.728731 IP lamp-ubuntu-s-1vcpu-1gb-tor1-01.ssh > 162.243.190.66.60588: Flags [P.], seq 2551664:2551920, ack 1, win 502, options [nop,nop,TS val 3493888848 ecr 2825817881], length 256
19:05:10.728779 IP lamp-ubuntu-s-1vcpu-1gb-tor1-01.ssh > 162.243.190.66.60588: Flags [P.], seq 2551920:2552176, ack 1, win 502, options [nop,nop,TS val 3493888848 ecr 2825817881], length 256
19:05:10.728822 IP lamp-ubuntu-s-1vcpu-1gb-tor1-01.ssh > 162.243.190.66.60588: Flags [P.], seq 2552176:2552432, ack 1, win 502, options [nop,nop,TS val 3493888848 ecr 2825817881], length 256
19:05:10.728862 IP lamp-ubuntu-s-1vcpu-1gb-tor1-01.ssh > 162.243.190.66.60588: Flags [P.], seq 2552432:2552688, ack 1, win 502, options [nop,nop,TS val 3493888848 ecr 2825817881], length 256
19:05:10.728901 IP lamp-ubuntu-s-1vcpu-1gb-tor1-01.ssh > 162.243.190.66.60588: Flags [P.], seq 2552688:2552944, ack 1, win 502, options [nop,nop,TS val 3493888848 ecr 2825817881], length 256
19:05:10.728944 IP lamp-ubuntu-s-1vcpu-1gb-tor1-01.ssh > 162.243.190.66.60588: Flags [P.], seq 2552944:2553200, ack 1, win 502, options [nop,nop,TS val 3493888848 ecr 2825817881], length 256
19:05:10.728993 IP lamp-ubuntu-s-1vcpu-1gb-tor1-01.ssh > 162.243.190.66.60588: Flags [P.], seq 2553200:2553456, ack 1, win 502, options [nop,nop,TS val 3493888848 ecr 2825817881], length 256
19:05:10.729051 IP lamp-ubuntu-s-1vcpu-1gb-tor1-01.ssh > 162.243.190.66.60588: Flags [P.], seq 2553456:2553712, ack 1, win 502, options [nop,nop,TS val 3493888848 ecr 2825817881], length 256
19:05:10.729098 IP lamp-ubuntu-s-1vcpu-1gb-tor1-01.ssh > 162.243.190.66.60588: Flags [P.], seq 2553712:2553968, ack 1, win 502, options [nop,nop,TS val 3493888848 ecr 2825817881], length 256
19:05:10.729142 IP lamp-ubuntu-s-1vcpu-1gb-tor1-01.ssh > 162.243.190.66.60588: Flags [P.], seq 2553968:2554224, ack 1, win 502, options [nop,nop,TS val 3493888848 ecr 2825817881], length 256
19:05:10.729198 IP lamp-ubuntu-s-1vcpu-1gb-tor1-01.ssh > 162.243.190.66.60588: Flags [P.], seq 2554224:2554480, ack 1, win 502, options [nop,nop,TS val 3493888848 ecr 2825817881], length 256
19:05:10.729342 IP lamp-ubuntu-s-1vcpu-1gb-tor1-01.ssh > 162.243.190.66.60588: Flags [P.], seq 2554480:2554736, ack 1, win 502, options [nop,nop,TS val 3493888848 ecr 2825817881], length 256
19:05:10.729407 IP lamp-ubuntu-s-1vcpu-1gb-tor1-01.ssh > 162.243.190.66.60588: Flags [P.], seq 2554736:2554992, ack 1, win 502, options [nop,nop,TS val 3493888848 ecr 2825817881], length 256
19:05:10.729456 IP lamp-ubuntu-s-1vcpu-1gb-tor1-01.ssh > 162.243.190.66.60588: Flags [P.], seq 2554992:2555248, ack 1, win 502, options [nop,nop,TS val 3493888848 ecr 2825817881], length 256
19:05:10.729495 IP lamp-ubuntu-s-1vcpu-1gb-tor1-01.ssh > 162.243.190.66.60588: Flags [P.], seq 2555248:2555504, ack 1, win 502, options [nop,nop,TS val 3493888848 ecr 2825817881], length 256
19:05:10.729548 IP 162.243.190.66.60588 > lamp-ubuntu-s-1vcpu-1gb-tor1-01.ssh: Flags [.], ack 2545008, win 255, options [nop,nop,TS val 2825817884 ecr 3493888846], length 0
19:05:10.729580 IP 162.243.190.66.60588 > lamp-ubuntu-s-1vcpu-1gb-tor1-01.ssh: Flags [.], ack 2554736, win 179, options [nop,nop,TS val 2825817884 ecr 3493888846], length 0
19:05:10.729659 IP lamp-ubuntu-s-1vcpu-1gb-tor1-01.ssh > 162.243.190.66.60588: Flags [P.], seq 2555504:2556096, ack 1, win 502, options [nop,nop,TS val 3493888849 ecr 2825817884], length 592
19:05:10.729729 IP lamp-ubuntu-s-1vcpu-1gb-tor1-01.ssh > 162.243.190.66.60588: Flags [P.], seq 2556096:2556352, ack 1, win 502, options [nop,nop,TS val 3493888849 ecr 2825817884], length 256
19:05:10.729787 IP lamp-ubuntu-s-1vcpu-1gb-tor1-01.ssh > 162.243.190.66.60588: Flags [P.], seq 2556352:2556608, ack 1, win 502, options [nop,nop,TS val 3493888849 ecr 2825817884], length 256
19:05:10.729850 IP lamp-ubuntu-s-1vcpu-1gb-tor1-01.ssh > 162.243.190.66.60588: Flags [P.], seq 2556608:2556864, ack 1, win 502, options [nop,nop,TS val 3493888849 ecr 2825817884], length 256
19:05:10.729904 IP 162.243.190.66.60588 > lamp-ubuntu-s-1vcpu-1gb-tor1-01.ssh: Flags [.], ack 2556352, win 167, options [nop,nop,TS val 2825817884 ecr 3493888848], length 0
19:05:10.729931 IP lamp-ubuntu-s-1vcpu-1gb-tor1-01.ssh > 162.243.190.66.60588: Flags [P.], seq 2556864:2557120, ack 1, win 502, options [nop,nop,TS val 3493888849 ecr 2825817884], length 256
19:05:10.730041 IP lamp-ubuntu-s-1vcpu-1gb-tor1-01.ssh > 162.243.190.66.60588: Flags [P.], seq 2557120:2557536, ack 1, win 502, options [nop,nop,TS val 3493888849 ecr 2825817884], length 416
19:05:10.730113 IP lamp-ubuntu-s-1vcpu-1gb-tor1-01.ssh > 162.243.190.66.60588: Flags [P.], seq 2557536:2557792, ack 1, win 502, options [nop,nop,TS val 3493888849 ecr 2825817884], length 256
19:05:10.730166 IP lamp-ubuntu-s-1vcpu-1gb-tor1-01.ssh > 162.243.190.66.60588: Flags [P.], seq 2557792:2558048, ack 1, win 502, options [nop,nop,TS val 3493888849 ecr 2825817884], length 256
19:05:10.730207 IP lamp-ubuntu-s-1vcpu-1gb-tor1-01.ssh > 162.243.190.66.60588: Flags [P.], seq 2558048:2558304, ack 1, win 502, options [nop,nop,TS val 3493888849 ecr 2825817884], length 256
19:05:10.730249 IP lamp-ubuntu-s-1vcpu-1gb-tor1-01.ssh > 162.243.190.66.60588: Flags [P.], seq 2558304:2558560, ack 1, win 502, options [nop,nop,TS val 3493888849 ecr 2825817884], length 256
19:05:10.730288 IP lamp-ubuntu-s-1vcpu-1gb-tor1-01.ssh > 162.243.190.66.60588: Flags [P.], seq 2558560:2558816, ack 1, win 502, options [nop,nop,TS val 3493888849 ecr 2825817884], length 256
19:05:10.730328 IP lamp-ubuntu-s-1vcpu-1gb-tor1-01.ssh > 162.243.190.66.60588: Flags [P.], seq 2558816:2559072, ack 1, win 502, options [nop,nop,TS val 3493888849 ecr 2825817884], length 256
19:05:10.730367 IP lamp-ubuntu-s-1vcpu-1gb-tor1-01.ssh > 162.243.190.66.60588: Flags [P.], seq 2559072:2559328, ack 1, win 502, options [nop,nop,TS val 3493888849 ecr 2825817884], length 256
19:05:10.730406 IP lamp-ubuntu-s-1vcpu-1gb-tor1-01.ssh > 162.243.190.66.60588: Flags [P.], seq 2559328:2559584, ack 1, win 502, options [nop,nop,TS val 3493888849 ecr 2825817884], length 256
19:05:10.730444 IP lamp-ubuntu-s-1vcpu-1gb-tor1-01.ssh > 162.243.190.66.60588: Flags [P.], seq 2559584:2559840, ack 1, win 502, options [nop,nop,TS val 3493888849 ecr 2825817884], length 256
19:05:10.730483 IP lamp-ubuntu-s-1vcpu-1gb-tor1-01.ssh > 162.243.190.66.60588: Flags [P.], seq 2559840:2560096, ack 1, win 502, options [nop,nop,TS val 3493888849 ecr 2825817884], length 256
19:05:10.730521 IP lamp-ubuntu-s-1vcpu-1gb-tor1-01.ssh > 162.243.190.66.60588: Flags [P.], seq 2560096:2560352, ack 1, win 502, options [nop,nop,TS val 3493888849 ecr 2825817884], length 256
19:05:10.730563 IP lamp-ubuntu-s-1vcpu-1gb-tor1-01.ssh > 162.243.190.66.60588: Flags [P.], seq 2560352:2560608, ack 1, win 502, options [nop,nop,TS val 3493888849 ecr 2825817884], length 256
19:05:10.730602 IP lamp-ubuntu-s-1vcpu-1gb-tor1-01.ssh > 162.243.190.66.60588: Flags [P.], seq 2560608:2560864, ack 1, win 502, options [nop,nop,TS val 3493888850 ecr 2825817884], length 256
19:05:10.730658 IP lamp-ubuntu-s-1vcpu-1gb-tor1-01.ssh > 162.243.190.66.60588: Flags [P.], seq 2560864:2561120, ack 1, win 502, options [nop,nop,TS val 3493888850 ecr 2825817884], length 256
19:05:10.730697 IP lamp-ubuntu-s-1vcpu-1gb-tor1-01.ssh > 162.243.190.66.60588: Flags [P.], seq 2561120:2561376, ack 1, win 502, options [nop,nop,TS val 3493888850 ecr 2825817884], length 256
19:05:10.730736 IP lamp-ubuntu-s-1vcpu-1gb-tor1-01.ssh > 162.243.190.66.60588: Flags [P.], seq 2561376:2561632, ack 1, win 502, options [nop,nop,TS val 3493888850 ecr 2825817884], length 256
19:05:10.730779 IP lamp-ubuntu-s-1vcpu-1gb-tor1-01.ssh > 162.243.190.66.60588: Flags [P.], seq 2561632:2561888, ack 1, win 502, options [nop,nop,TS val 3493888850 ecr 2825817884], length 256
19:05:10.730817 IP lamp-ubuntu-s-1vcpu-1gb-tor1-01.ssh > 162.243.190.66.60588: Flags [P.], seq 2561888:2562144, ack 1, win 502, options [nop,nop,TS val 3493888850 ecr 2825817884], length 256
19:05:10.730856 IP lamp-ubuntu-s-1vcpu-1gb-tor1-01.ssh > 162.243.190.66.60588: Flags [P.], seq 2562144:2562400, ack 1, win 502, options [nop,nop,TS val 3493888850 ecr 2825817884], length 256
19:05:10.730894 IP lamp-ubuntu-s-1vcpu-1gb-tor1-01.ssh > 162.243.190.66.60588: Flags [P.], seq 2562400:2562656, ack 1, win 502, options [nop,nop,TS val 3493888850 ecr 2825817884], length 256
19:05:10.730933 IP lamp-ubuntu-s-1vcpu-1gb-tor1-01.ssh > 162.243.190.66.60588: Flags [P.], seq 2562656:2562912, ack 1, win 502, options [nop,nop,TS val 3493888850 ecr 2825817884], length 256
19:05:10.730974 IP lamp-ubuntu-s-1vcpu-1gb-tor1-01.ssh > 162.243.190.66.60588: Flags [P.], seq 2562912:2563168, ack 1, win 502, options [nop,nop,TS val 3493888850 ecr 2825817884], length 256
19:05:10.731012 IP lamp-ubuntu-s-1vcpu-1gb-tor1-01.ssh > 162.243.190.66.60588: Flags [P.], seq 2563168:2563424, ack 1, win 502, options [nop,nop,TS val 3493888850 ecr 2825817884], length 256
19:05:10.731052 IP lamp-ubuntu-s-1vcpu-1gb-tor1-01.ssh > 162.243.190.66.60588: Flags [P.], seq 2563424:2563680, ack 1, win 502, options [nop,nop,TS val 3493888850 ecr 2825817884], length 256
19:05:10.731109 IP lamp-ubuntu-s-1vcpu-1gb-tor1-01.ssh > 162.243.190.66.60588: Flags [P.], seq 2563680:2563936, ack 1, win 502, options [nop,nop,TS val 3493888850 ecr 2825817884], length 256
19:05:10.731149 IP lamp-ubuntu-s-1vcpu-1gb-tor1-01.ssh > 162.243.190.66.60588: Flags [P.], seq 2563936:2564192, ack 1, win 502, options [nop,nop,TS val 3493888850 ecr 2825817884], length 256
19:05:10.731189 IP lamp-ubuntu-s-1vcpu-1gb-tor1-01.ssh > 162.243.190.66.60588: Flags [P.], seq 2564192:2564448, ack 1, win 502, options [nop,nop,TS val 3493888850 ecr 2825817884], length 256
19:05:10.731228 IP lamp-ubuntu-s-1vcpu-1gb-tor1-01.ssh > 162.243.190.66.60588: Flags [P.], seq 2564448:2564704, ack 1, win 502, options [nop,nop,TS val 3493888850 ecr 2825817884], length 256
19:05:10.731281 IP lamp-ubuntu-s-1vcpu-1gb-tor1-01.ssh > 162.243.190.66.60588: Flags [P.], seq 2564704:2564960, ack 1, win 502, options [nop,nop,TS val 3493888850 ecr 2825817884], length 256
19:05:10.731326 IP lamp-ubuntu-s-1vcpu-1gb-tor1-01.ssh > 162.243.190.66.60588: Flags [P.], seq 2564960:2565216, ack 1, win 502, options [nop,nop,TS val 3493888850 ecr 2825817884], length 256
19:05:10.731386 IP lamp-ubuntu-s-1vcpu-1gb-tor1-01.ssh > 162.243.190.66.60588: Flags [P.], seq 2565216:2565472, ack 1, win 502, options [nop,nop,TS val 3493888850 ecr 2825817884], length 256
19:05:10.731441 IP lamp-ubuntu-s-1vcpu-1gb-tor1-01.ssh > 162.243.190.66.60588: Flags [P.], seq 2565472:2565728, ack 1, win 502, options [nop,nop,TS val 3493888850 ecr 2825817884], length 256
19:05:10.731479 IP lamp-ubuntu-s-1vcpu-1gb-tor1-01.ssh > 162.243.190.66.60588: Flags [P.], seq 2565728:2565984, ack 1, win 502, options [nop,nop,TS val 3493888850 ecr 2825817884], length 256
19:05:10.731517 IP lamp-ubuntu-s-1vcpu-1gb-tor1-01.ssh > 162.243.190.66.60588: Flags [P.], seq 2565984:2566240, ack 1, win 502, options [nop,nop,TS val 3493888850 ecr 2825817884], length 256
19:05:10.731556 IP lamp-ubuntu-s-1vcpu-1gb-tor1-01.ssh > 162.243.190.66.60588: Flags [P.], seq 2566240:2566496, ack 1, win 502, options [nop,nop,TS val 3493888850 ecr 2825817884], length 256
19:05:10.731598 IP lamp-ubuntu-s-1vcpu-1gb-tor1-01.ssh > 162.243.190.66.60588: Flags [P.], seq 2566496:2566752, ack 1, win 502, options [nop,nop,TS val 3493888851 ecr 2825817884], length 256
19:05:10.731639 IP lamp-ubuntu-s-1vcpu-1gb-tor1-01.ssh > 162.243.190.66.60588: Flags [P.], seq 2566752:2567008, ack 1, win 502, options [nop,nop,TS val 3493888851 ecr 2825817884], length 256
19:05:10.731678 IP lamp-ubuntu-s-1vcpu-1gb-tor1-01.ssh > 162.243.190.66.60588: Flags [P.], seq 2567008:2567264, ack 1, win 502, options [nop,nop,TS val 3493888851 ecr 2825817884], length 256
19:05:10.731717 IP lamp-ubuntu-s-1vcpu-1gb-tor1-01.ssh > 162.243.190.66.60588: Flags [P.], seq 2567264:2567520, ack 1, win 502, options [nop,nop,TS val 3493888851 ecr 2825817884], length 256
19:05:10.731758 IP lamp-ubuntu-s-1vcpu-1gb-tor1-01.ssh > 162.243.190.66.60588: Flags [P.], seq 2567520:2567776, ack 1, win 502, options [nop,nop,TS val 3493888851 ecr 2825817884], length 256
19:05:10.731801 IP lamp-ubuntu-s-1vcpu-1gb-tor1-01.ssh > 162.243.190.66.60588: Flags [P.], seq 2567776:2568032, ack 1, win 502, options [nop,nop,TS val 3493888851 ecr 2825817884], length 256
19:05:10.731840 IP lamp-ubuntu-s-1vcpu-1gb-tor1-01.ssh > 162.243.190.66.60588: Flags [P.], seq 2568032:2568288, ack 1, win 502, options [nop,nop,TS val 3493888851 ecr 2825817884], length 256
19:05:10.731879 IP lamp-ubuntu-s-1vcpu-1gb-tor1-01.ssh > 162.243.190.66.60588: Flags [P.], seq 2568288:2568544, ack 1, win 502, options [nop,nop,TS val 3493888851 ecr 2825817884], length 256
19:05:10.731921 IP lamp-ubuntu-s-1vcpu-1gb-tor1-01.ssh > 162.243.190.66.60588: Flags [P.], seq 2568544:2568800, ack 1, win 502, options [nop,nop,TS val 3493888851 ecr 2825817884], length 256
19:05:10.731960 IP lamp-ubuntu-s-1vcpu-1gb-tor1-01.ssh > 162.243.190.66.60588: Flags [P.], seq 2568800:2569056, ack 1, win 502, options [nop,nop,TS val 3493888851 ecr 2825817884], length 256
19:05:10.732019 IP lamp-ubuntu-s-1vcpu-1gb-tor1-01.ssh > 162.243.190.66.60588: Flags [P.], seq 2569056:2569312, ack 1, win 502, options [nop,nop,TS val 3493888851 ecr 2825817884], length 256
19:05:10.732085 IP lamp-ubuntu-s-1vcpu-1gb-tor1-01.ssh > 162.243.190.66.60588: Flags [P.], seq 2569312:2569568, ack 1, win 502, options [nop,nop,TS val 3493888851 ecr 2825817884], length 256
19:05:10.732143 IP lamp-ubuntu-s-1vcpu-1gb-tor1-01.ssh > 162.243.190.66.60588: Flags [P.], seq 2569568:2569824, ack 1, win 502, options [nop,nop,TS val 3493888851 ecr 2825817884], length 256
19:05:10.732192 IP lamp-ubuntu-s-1vcpu-1gb-tor1-01.ssh > 162.243.190.66.60588: Flags [P.], seq 2569824:2570080, ack 1, win 502, options [nop,nop,TS val 3493888851 ecr 2825817884], length 256
19:05:10.732233 IP lamp-ubuntu-s-1vcpu-1gb-tor1-01.ssh > 162.243.190.66.60588: Flags [P.], seq 2570080:2570336, ack 1, win 502, options [nop,nop,TS val 3493888851 ecr 2825817884], length 256
19:05:10.732276 IP lamp-ubuntu-s-1vcpu-1gb-tor1-01.ssh > 162.243.190.66.60588: Flags [P.], seq 2570336:2570592, ack 1, win 502, options [nop,nop,TS val 3493888851 ecr 2825817884], length 256
19:05:10.732315 IP lamp-ubuntu-s-1vcpu-1gb-tor1-01.ssh > 162.243.190.66.60588: Flags [P.], seq 2570592:2570848, ack 1, win 502, options [nop,nop,TS val 3493888851 ecr 2825817884], length 256
19:05:10.732379 IP lamp-ubuntu-s-1vcpu-1gb-tor1-01.ssh > 162.243.190.66.60588: Flags [P.], seq 2570848:2571104, ack 1, win 502, options [nop,nop,TS val 3493888851 ecr 2825817884], length 256
19:05:10.732438 IP lamp-ubuntu-s-1vcpu-1gb-tor1-01.ssh > 162.243.190.66.60588: Flags [P.], seq 2571104:2571360, ack 1, win 502, options [nop,nop,TS val 3493888851 ecr 2825817884], length 256
19:05:10.732464 IP 162.243.190.66.60588 > lamp-ubuntu-s-1vcpu-1gb-tor1-01.ssh: Flags [.], ack 2558304, win 152, options [nop,nop,TS val 2825817887 ecr 3493888849], length 0
19:05:10.732499 IP 162.243.190.66.60588 > lamp-ubuntu-s-1vcpu-1gb-tor1-01.ssh: Flags [.], ack 2570336, win 58, options [nop,nop,TS val 2825817887 ecr 3493888849], length 0
19:05:10.732567 IP lamp-ubuntu-s-1vcpu-1gb-tor1-01.ssh > 162.243.190.66.60588: Flags [P.], seq 2571360:2571952, ack 1, win 502, options [nop,nop,TS val 3493888851 ecr 2825817887], length 592
19:05:10.732610 IP lamp-ubuntu-s-1vcpu-1gb-tor1-01.ssh > 162.243.190.66.60588: Flags [P.], seq 2571952:2572208, ack 1, win 502, options [nop,nop,TS val 3493888852 ecr 2825817887], length 256
19:05:10.732651 IP lamp-ubuntu-s-1vcpu-1gb-tor1-01.ssh > 162.243.190.66.60588: Flags [P.], seq 2572208:2572464, ack 1, win 502, options [nop,nop,TS val 3493888852 ecr 2825817887], length 256
19:05:10.732692 IP lamp-ubuntu-s-1vcpu-1gb-tor1-01.ssh > 162.243.190.66.60588: Flags [P.], seq 2572464:2572720, ack 1, win 502, options [nop,nop,TS val 3493888852 ecr 2825817887], length 256
19:05:10.732723 IP 162.243.190.66.60588 > lamp-ubuntu-s-1vcpu-1gb-tor1-01.ssh: Flags [.], ack 2571952, win 46, options [nop,nop,TS val 2825817887 ecr 3493888851], length 0
19:05:10.732776 IP lamp-ubuntu-s-1vcpu-1gb-tor1-01.ssh > 162.243.190.66.60588: Flags [P.], seq 2572720:2573136, ack 1, win 502, options [nop,nop,TS val 3493888852 ecr 2825817887], length 416
19:05:10.732825 IP lamp-ubuntu-s-1vcpu-1gb-tor1-01.ssh > 162.243.190.66.60588: Flags [P.], seq 2573136:2573392, ack 1, win 502, options [nop,nop,TS val 3493888852 ecr 2825817887], length 256
19:05:10.732881 IP lamp-ubuntu-s-1vcpu-1gb-tor1-01.ssh > 162.243.190.66.60588: Flags [P.], seq 2573392:2573648, ack 1, win 502, options [nop,nop,TS val 3493888852 ecr 2825817887], length 256
19:05:10.732937 IP lamp-ubuntu-s-1vcpu-1gb-tor1-01.ssh > 162.243.190.66.60588: Flags [P.], seq 2573648:2573904, ack 1, win 502, options [nop,nop,TS val 3493888852 ecr 2825817887], length 256
19:05:10.732982 IP lamp-ubuntu-s-1vcpu-1gb-tor1-01.ssh > 162.243.190.66.60588: Flags [P.], seq 2573904:2574160, ack 1, win 502, options [nop,nop,TS val 3493888852 ecr 2825817887], length 256
19:05:10.733021 IP lamp-ubuntu-s-1vcpu-1gb-tor1-01.ssh > 162.243.190.66.60588: Flags [P.], seq 2574160:2574416, ack 1, win 502, options [nop,nop,TS val 3493888852 ecr 2825817887], length 256
19:05:10.733059 IP lamp-ubuntu-s-1vcpu-1gb-tor1-01.ssh > 162.243.190.66.60588: Flags [P.], seq 2574416:2574672, ack 1, win 502, options [nop,nop,TS val 3493888852 ecr 2825817887], length 256
19:05:10.733101 IP lamp-ubuntu-s-1vcpu-1gb-tor1-01.ssh > 162.243.190.66.60588: Flags [P.], seq 2574672:2574928, ack 1, win 502, options [nop,nop,TS val 3493888852 ecr 2825817887], length 256
19:05:10.733124 IP 162.243.190.66.60588 > lamp-ubuntu-s-1vcpu-1gb-tor1-01.ssh: Flags [.], ack 2573648, win 33, options [nop,nop,TS val 2825817887 ecr 3493888852], length 0
19:05:10.733162 IP lamp-ubuntu-s-1vcpu-1gb-tor1-01.ssh > 162.243.190.66.60588: Flags [P.], seq 2574928:2575344, ack 1, win 502, options [nop,nop,TS val 3493888852 ecr 2825817887], length 416
19:05:10.733205 IP lamp-ubuntu-s-1vcpu-1gb-tor1-01.ssh > 162.243.190.66.60588: Flags [P.], seq 2575344:2575600, ack 1, win 502, options [nop,nop,TS val 3493888852 ecr 2825817887], length 256
19:05:10.733245 IP lamp-ubuntu-s-1vcpu-1gb-tor1-01.ssh > 162.243.190.66.60588: Flags [P.], seq 2575600:2575856, ack 1, win 502, options [nop,nop,TS val 3493888852 ecr 2825817887], length 256
19:05:10.733284 IP lamp-ubuntu-s-1vcpu-1gb-tor1-01.ssh > 162.243.190.66.60588: Flags [P.], seq 2575856:2576112, ack 1, win 502, options [nop,nop,TS val 3493888852 ecr 2825817887], length 256
19:05:10.733324 IP lamp-ubuntu-s-1vcpu-1gb-tor1-01.ssh > 162.243.190.66.60588: Flags [P.], seq 2576112:2576368, ack 1, win 502, options [nop,nop,TS val 3493888852 ecr 2825817887], length 256
19:05:10.733363 IP lamp-ubuntu-s-1vcpu-1gb-tor1-01.ssh > 162.243.190.66.60588: Flags [P.], seq 2576368:2576624, ack 1, win 502, options [nop,nop,TS val 3493888852 ecr 2825817887], length 256
19:05:10.733403 IP lamp-ubuntu-s-1vcpu-1gb-tor1-01.ssh > 162.243.190.66.60588: Flags [P.], seq 2576624:2576880, ack 1, win 502, options [nop,nop,TS val 3493888852 ecr 2825817887], length 256
19:05:10.733442 IP lamp-ubuntu-s-1vcpu-1gb-tor1-01.ssh > 162.243.190.66.60588: Flags [P.], seq 2576880:2577136, ack 1, win 502, options [nop,nop,TS val 3493888852 ecr 2825817887], length 256
19:05:10.733485 IP lamp-ubuntu-s-1vcpu-1gb-tor1-01.ssh > 162.243.190.66.60588: Flags [P.], seq 2577136:2577392, ack 1, win 502, options [nop,nop,TS val 3493888852 ecr 2825817887], length 256
19:05:10.733539 IP lamp-ubuntu-s-1vcpu-1gb-tor1-01.ssh > 162.243.190.66.60588: Flags [P.], seq 2577392:2577648, ack 1, win 502, options [nop,nop,TS val 3493888852 ecr 2825817887], length 256
19:05:10.733850 IP 162.243.190.66.60588 > lamp-ubuntu-s-1vcpu-1gb-tor1-01.ssh: Flags [.], ack 2577648, win 2, options [nop,nop,TS val 2825817888 ecr 3493888852], length 0
19:05:10.733863 IP lamp-ubuntu-s-1vcpu-1gb-tor1-01.ssh > 162.243.190.66.60588: Flags [P.], seq 2577648:2577904, ack 1, win 502, options [nop,nop,TS val 3493888853 ecr 2825817888], length 256
19:05:10.775457 IP 162.243.190.66.60588 > lamp-ubuntu-s-1vcpu-1gb-tor1-01.ssh: Flags [.], ack 2577904, win 0, options [nop,nop,TS val 2825817930 ecr 3493888853], length 0
19:05:10.782580 IP 162.243.190.66.60588 > lamp-ubuntu-s-1vcpu-1gb-tor1-01.ssh: Flags [.], ack 2577904, win 275, options [nop,nop,TS val 2825817937 ecr 3493888853], length 0
19:05:10.782628 IP lamp-ubuntu-s-1vcpu-1gb-tor1-01.ssh > 162.243.190.66.60588: Flags [P.], seq 2577904:2578544, ack 1, win 502, options [nop,nop,TS val 3493888902 ecr 2825817937], length 640
19:05:10.782809 IP lamp-ubuntu-s-1vcpu-1gb-tor1-01.ssh > 162.243.190.66.60588: Flags [P.], seq 2578544:2578960, ack 1, win 502, options [nop,nop,TS val 3493888902 ecr 2825817937], length 416
19:05:10.782862 IP lamp-ubuntu-s-1vcpu-1gb-tor1-01.ssh > 162.243.190.66.60588: Flags [P.], seq 2578960:2579216, ack 1, win 502, options [nop,nop,TS val 3493888902 ecr 2825817937], length 256
19:05:10.782909 IP lamp-ubuntu-s-1vcpu-1gb-tor1-01.ssh > 162.243.190.66.60588: Flags [P.], seq 2579216:2579472, ack 1, win 502, options [nop,nop,TS val 3493888902 ecr 2825817937], length 256
19:05:10.782953 IP lamp-ubuntu-s-1vcpu-1gb-tor1-01.ssh > 162.243.190.66.60588: Flags [P.], seq 2579472:2579728, ack 1, win 502, options [nop,nop,TS val 3493888902 ecr 2825817937], length 256
19:05:10.782997 IP lamp-ubuntu-s-1vcpu-1gb-tor1-01.ssh > 162.243.190.66.60588: Flags [P.], seq 2579728:2579984, ack 1, win 502, options [nop,nop,TS val 3493888902 ecr 2825817937], length 256
19:05:10.783040 IP lamp-ubuntu-s-1vcpu-1gb-tor1-01.ssh > 162.243.190.66.60588: Flags [P.], seq 2579984:2580240, ack 1, win 502, options [nop,nop,TS val 3493888902 ecr 2825817937], length 256
19:05:10.783094 IP lamp-ubuntu-s-1vcpu-1gb-tor1-01.ssh > 162.243.190.66.60588: Flags [P.], seq 2580240:2580496, ack 1, win 502, options [nop,nop,TS val 3493888902 ecr 2825817937], length 256
19:05:10.783137 IP lamp-ubuntu-s-1vcpu-1gb-tor1-01.ssh > 162.243.190.66.60588: Flags [P.], seq 2580496:2580752, ack 1, win 502, options [nop,nop,TS val 3493888902 ecr 2825817937], length 256
19:05:10.783179 IP lamp-ubuntu-s-1vcpu-1gb-tor1-01.ssh > 162.243.190.66.60588: Flags [P.], seq 2580752:2581008, ack 1, win 502, options [nop,nop,TS val 3493888902 ecr 2825817937], length 256
