root@lamp-ubuntu-s-1vcpu-1gb-tor1-01:~# tcpdump -c 5 -i eth0
tcpdump: verbose output suppressed, use -v or -vv for full protocol decode
listening on eth0, link-type EN10MB (Ethernet), capture size 262144 bytes
19:06:24.235729 IP lamp-ubuntu-s-1vcpu-1gb-tor1-01.ssh > 162.243.190.66.60588: Flags [P.], seq 2205374472:2205374600, ack 720864900, win 502, options [nop,nop,TS val 3493962355 ecr 2825891386], length 128
19:06:24.235790 IP lamp-ubuntu-s-1vcpu-1gb-tor1-01.ssh > 162.243.190.66.60588: Flags [P.], seq 128:192, ack 1, win 502, options [nop,nop,TS val 3493962355 ecr 2825891386], length 64
19:06:24.235826 IP lamp-ubuntu-s-1vcpu-1gb-tor1-01.ssh > 162.243.190.66.60588: Flags [P.], seq 192:320, ack 1, win 502, options [nop,nop,TS val 3493962355 ecr 2825891386], length 128
19:06:24.235856 IP lamp-ubuntu-s-1vcpu-1gb-tor1-01.ssh > 162.243.190.66.60588: Flags [P.], seq 320:384, ack 1, win 502, options [nop,nop,TS val 3493962355 ecr 2825891386], length 64
19:06:24.235946 IP 162.243.190.66.60588 > lamp-ubuntu-s-1vcpu-1gb-tor1-01.ssh: Flags [.], ack 128, win 501, options [nop,nop,TS val 2825891390 ecr 3493962355], length 0
5 packets captured
51 packets received by filter
13 packets dropped by kernel